Item Type,title,year,issue_date,publisher,address,volume,number,url,doi,abstract,journal,month,articleno,numpages,keywords,Authors,isbn,booktitle,pages,location,series,issn
inproceedings,Privacy-Enhancing Fall Detection from Remote Sensor Data Using Multi-Party Computation,2019,,Association for Computing Machinery,"New York, NY, USA",,,https://doi.org/10.1145/3339252.3340500,10.1145/3339252.3340500,"Motion-based fall detection systems are concerned with detecting falls from vulnerable users, which is typically performed by classifying measurements from a body-worn inertial measurement unit (IMU) using machine learning. Such systems, however, necessitate the collection of high-resolution measurements that may violate users' privacy, such as revealing their gait, activities of daily living (ADLs), and relative position using dead reckoning. In this paper, we investigate the application of multi-party computation (MPC) to IMU-based fall detection for protecting device measurement confidentiality. Our system is evaluated in a cloud-based setting that precludes parties from learning the underlying data using multiple, disparate cloud instances deployed in three geographical configurations. Using a publicly-available dataset, we demonstrate that MPC-based fall detection from IMU measurements is practical while achieving state-of-the-art error rates. In the best case, our system executes in 365.2 milliseconds, which falls well within the required time window for on-device data acquisition (750ms).",,,73,10,"multi-party computation (MPC), cloud computing, Internet of Things (IoT), Fall detection","Mainali, Pradip; Shepherd, Carlton",9781450371643,"Proceedings of the 14th International Conference on Availability, Reliability and Security",,"Canterbury, CA, United Kingdom",ARES '19,
article,Pervasive Pose Estimation for Fall Detection,2022,July 2022,Association for Computing Machinery,"New York, NY, USA",3,3,https://doi.org/10.1145/3478027,10.1145/3478027,"Falls are the second leading cause of accidental or unintentional injuries/deaths worldwide. Accurate pose estimation using commodity mobile devices will help early detection and injury assessment of falls, which are essential for the first aid of elderly falls. By following the definition of fall, we propose a Pervasive Pose Estimation scheme for fall detection (P ( ^2 ) Est), which measures changes in tilt angle and height of the human body. For the tilt measurement, P ( ^2 ) Est leverages the pointing of the mobile device, e.g., the smartphone, when unlocking to associate the Device coordinate system with the World coordinate system. For the height measurement, P ( ^2 ) Est exploits the fact that the person’s height remains unchanged while walking to calibrate the pressure difference between the device and the floor. We have prototyped and tested P ( ^2 ) Est in various situations and environments. Our extensive experimental results have demonstrated that P ( ^2 ) Est can track the body orientation irrespective of which pocket the phone is placed in. More importantly, it enables the phone’s barometer to detect falls in various environments with decimeter-level accuracy.",ACM Trans. Comput. Healthcare,April,27,23,"transformation, pose estimation, fall detection, Pervasive","Luo, Jiaqing; Bai, Ruiyu; He, Suining; Shin, Kang",,,,,,
inproceedings,Syncope Detection in Toilet Environments Using Wi-Fi Channel State Information,2018,,Association for Computing Machinery,"New York, NY, USA",,,https://doi.org/10.1145/3267305.3267650,10.1145/3267305.3267650,"Syncope and strokes in toilets can lead to severe injuries, and even pose life threats to patients. However, owing to privacy concerns, vision-based fall detection cannot be applied in such a scenario. In this poster, we propose ToiFall, a prototype for syncope detection in toilet environments. ToiFall collects Channel State Information (CSI) of commodity Wi-Fi devices. Different human movements form various textures on CSI images, and such textures can be used for feature extraction and classification. Experimental results show an accuracy of over 98% for fall detection with satisfying reliability.",,,,4,"Fall detection, Channel state information, Action recognition","Wang, Ziqi; Gu, Zhihao; Yin, Junwei; Chen, Zhe; Xu, Yuedong",9781450359665,Proceedings of the 2018 ACM International Joint Conference and 2018 International Symposium on Pervasive and Ubiquitous Computing and Wearable Computers,287–290,"Singapore, Singapore",UbiComp '18,
article,A Systematic Review of Digital Twin Technology for Home Care,2024,October 2024,Association for Computing Machinery,"New York, NY, USA",5,4,https://doi.org/10.1145/3681797,10.1145/3681797,"The concept of digital twin has captured significant attention in recent years, and its potential application within the domain of home care has been explored in several studies. This review endeavors to provide a comprehensive overview of digital twin technology and its applications in the realm of home care, delineating the key attributes and challenges entailed in their implementation. A systematic search was conducted across five databases, namely ACM digital library, IEEE Xplore, PubMed, Scopus, and Web of Science. Findings from forty-five included articles were categorized employing a systematic approach, highlighting the technology's deployment in remote older adults’ care monitoring, health issue prediction and personalized treatment planning. Furthermore, this review identified the challenges of integrating digital twins into the home care sector. Despite recognition of its potential, there is a distinct lack in the literature of in-depth studies specifically exploring the implementation of digital twin technology in home care, highlighting the need for further research.",ACM Trans. Comput. Healthcare,November,20,24,"Human Activity Recognition, Social Care, Cloud Computing, Physiological Signals, Human-Computer Interaction (HCI)","Zafar, Raja; Rybarczyk, Yves; Borg, Johan",,,,,,
inproceedings,GUFO: Three studies in the initial development of an assistive drone for older people living independently,2024,,Association for Computing Machinery,"New York, NY, USA",,,https://doi.org/10.1145/3679318.3685409,10.1145/3679318.3685409,"Drones have the potential to provide support to older people who are living independently, but little research has as yet explored this topic. This paper presents three studies with older people to explore their attitudes to having a drone (called GUFO) as a technology in their home and how it could be useful to them. In the first study, a “marionette drone” was demonstrated to participants, showing them how the drone would move and generally establishing how close they would be comfortable to have it. An adaptation for drone of the Negative Attitudes towards Robots (NARS) Questionnaire showed that participants were positive about the idea of a drone in their home, a view confirmed by semi-structured interviews. In a second study, two different drones were flown to demonstrate aspects of the GUFO system: its noise and airflow and its ability to fetch small objects. Half of the participants were concerned about noise and airflow, but the other half were either not concerned or thought the noise a useful indication of where the drone was located. The ability to find rather than fetch objects was considered very useful. A third study demonstrated a full working version of the drone in a larger prototype and the ability of the system to detect a person who has fallen. The size of this version did concern some participants. Attitudes to drones were measured in this study using a adapted version of the Almere model, and again were found to be generally positive. Implications for the further development of drone technology for older people living independently are discussed.",,,73,16,"Ageing in place, Ambient Assisted Living, Drones, Older people, Unmanned autonomous vehicles","Samaddar, Sanjit; Petrie, Helen",9798400709661,Proceedings of the 13th Nordic Conference on Human-Computer Interaction,,"Uppsala, Sweden",NordiCHI '24,
inproceedings,Wearable camera for fall detection embedded system,2019,,Association for Computing Machinery,"New York, NY, USA",,,https://doi.org/10.1145/3368756.3369053,10.1145/3368756.3369053,"The fall is one of the major problems that threaten the health of the elderly. According to world statistics, between 28% and 35% of seniors aged over 65 suffer from at least one fall per year. Continuous monitoring and early detection of critical events such as falls, allow for rapid response and immediate medical management. For this, several fall detection devices have been designed by the researchers. In this paper, we propose a fall detection system based on a portable camera. The camera is worn by the user, which allows him to follow his activity wherever he moves, whether indoors or outdoors. In addition, since it is the environment and not the individual that is being observed, the privacy issue is mitigated. The proposed fall detection method is a new approach based on the original Histogram of Oriented Gradient version (HOG) that we combine with the Optical Flow to improve system performance in detecting true falls. Our method has been implemented on a Raspberry embedded on the developed device, which allows us to parallelize the calculations and thus to answer the real time constraint. The results of the 20 tests performed on 09 subjects; show that the falls can be detected with a sensitivity of 95% from the standing position. The combination of optical flow with HOG has improved the specificity, for the rotation scenario, by increasing it by 50% compared to the use of HOG alone. As a result, we have achieved a specificity of 90%. Experimental results show the success of the proposed method.",,,70,6,"portable camera, optical flow, histogram of oriented gradient, fall detection, embedded system","Boudouane, Isma; Makhlouf, Amina; Saadia, Nadia; Ramdane-Cherif, Amar",9781450362894,Proceedings of the 4th International Conference on Smart City Applications,,"Casablanca, Morocco",SCA '19,
inproceedings,WiFi Sensing with Single-Antenna Devices for Ambient Assisted Living,2023,,Association for Computing Machinery,"New York, NY, USA",,,https://doi.org/10.1145/3615834.3615841,10.1145/3615834.3615841,"The absolute coverage WiFi networks is higher than it has ever been and WiFi sensing offers a device-free, contactless alternative to intrusive wearable devices for a variety of applications, in particular for ambient assisted living (AAL). However, a majority of sensing systems proposed in literature use multiple antennas for sensing, resulting in high cost that hinders development of such solutions in real life. This work surveys existing single-antenna systems as a low-cost solution in an AAL scenario. The capabilities of these systems are examined regarding their practical applicability based on testing in AAL environments, leveraging multiple links (i.e. transmitter-receiver pairs) and considering mobile and repositioned receivers. It is found that while the AAL use-cases of respiration monitoring, fall detection and activity recognition are realised by existing systems, further testing in realistic AAL environments with the inclusion of activities of daily living is needed. Additionally the full use of multiple links and consideration of a mobile receiver is still rare, but shows promising improvements. A multi-task system enabling all three applications is discussed using the Model for Ethical Evaluation of Socio-Technical Arrangements (MEESTAR). We suggest an ethically sensitive use, but identify a need for mitigation strategies to address privacy-related concerns of potentially unwilling users.",,,3,8,"WiFi sensing, ambient assisted living, social aspects of security and privacy, ubiquitous computing","Schumann, Robert; Li, Frederic; Grzegorzek, Marcin",9798400708169,Proceedings of the 8th International Workshop on Sensor-Based Activity Recognition and Artificial Intelligence,,"L\""{u}beck, Germany",iWOAR '23,
article,Fall Detection via Inaudible Acoustic Sensing,2021,Sept 2021,Association for Computing Machinery,"New York, NY, USA",5,3,https://doi.org/10.1145/3478094,10.1145/3478094,"The fall detection system is of critical importance in protecting elders through promptly discovering fall accidents to provide immediate medical assistance, potentially saving elders' lives. This paper aims to develop a novel and lightweight fall detection system by relying solely on a home audio device via inaudible acoustic sensing, to recognize fall occurrences for wide home deployment. In particular, we program the audio device to let its speaker emit 20kHz continuous wave, while utilizing a microphone to record reflected signals for capturing the Doppler shift caused by the fall. Considering interferences from different factors, we first develop a set of solutions for their removal to get clean spectrograms and then apply the power burst curve to locate the time points at which human motions happen. A set of effective features is then extracted from the spectrograms for representing the fall patterns, distinguishable from normal activities. We further apply the Singular Value Decomposition (SVD) and K-mean algorithms to reduce the data feature dimensions and to cluster the data, respectively, before input them to a Hidden Markov Model for training and classification. In the end, our system is implemented and deployed in various environments for evaluation. The experimental results demonstrate that our system can achieve superior performance for detecting fall accidents and is robust to environment changes, i.e., transferable to other environments after training in one environment.",Proc. ACM Interact. Mob. Wearable Ubiquitous Technol.,September,114,21,"Ultrasonic, Hidden Markov Model, Fall Detection, Device-free","Lian, Jie; Yuan, Xu; Li, Ming; Tzeng, Nian-Feng",,,,,,
article,XRF55: A Radio Frequency Dataset for Human Indoor Action Analysis,2024,March 2024,Association for Computing Machinery,"New York, NY, USA",8,1,https://doi.org/10.1145/3643543,10.1145/3643543,"Radio frequency (RF) devices such as Wi-Fi transceivers, radio frequency identification tags, and millimeter-wave radars have appeared in large numbers in daily lives. The presence and movement of humans can affect the propagation of RF signals, further, this phenomenon is exploited for human action recognition. Compared to camera solutions, RF approaches exhibit greater resilience to occlusions and lighting conditions, while also raising fewer privacy concerns in indoor scenarios. However, current works have many limitations, including the unavailability of datasets, insufficient training samples, and simple or limited action categories for specific applications, which seriously hinder the growth of RF solutions, presenting a significant obstacle in transitioning RF sensing research from the laboratory to a wide range of everyday life applications. To facilitate the transitioning, in this paper, we introduce and release a large-scale multiple radio frequency dataset, named XRF55, for indoor human action analysis. XRF55 encompasses 42.9K RF samples and 55 action classes of human-object interactions, human-human interactions, fitness, body motions, and human-computer interactions, collected from 39 subjects within 100 days. These actions were meticulously selected from 19 RF sensing papers and 16 video action recognition datasets. Each action is chosen to support various applications with high practical value, such as elderly fall detection, fatigue monitoring, domestic violence detection, etc. Moreover, XRF55 contains 23 RFID tags at 922.38MHz, 9 Wi-Fi links at 5.64GHz, one mmWave radar at 60-64GHz, and one Azure Kinect with RGB+D+IR sensors, covering frequency across decimeter wave, centimeter wave, and millimeter wave. In addition, we apply a mutual learning strategy over XRF55 for the task of action recognition. Unlike simple modality fusion, under mutual learning, three RF modalities are trained collaboratively and then work solely. We find these three RF modalities will promote each other. It is worth mentioning that, with synchronized Kinect, XRF55 also supports the exploration of action detection, action segmentation, pose estimation, human parsing, mesh reconstruction, etc., with RF-only or RF-Vision approaches.",Proc. ACM Interact. Mob. Wearable Ubiquitous Technol.,March,21,34,"RFID, Wi-Fi, dataset, human action recognition, millimeter-wave radar, mutual learning","Wang, Fei; Lv, Yizhe; Zhu, Mengdie; Ding, Han; Han, Jinsong",,,,,,
inproceedings,An Integrated Approach to Fall Detection and Fall Risk Estimation Based on RGB-Depth and Inertial Sensors,2016,,Association for Computing Machinery,"New York, NY, USA",,,https://doi.org/10.1145/3019943.3019979,10.1145/3019943.3019979,"Population ageing is a growing phenomenon, especially in Europe, so researchers are developing Active and Assisted Living solutions to promote ageing in place of elderly people. One of the most critical issues is represented by falls, and the development of fall risk estimation and fall detection tools can increase safety of elderly. The aim of this work is to develop fall risk estimation and fall detection tools using data extracted from wearable and vision-based sensors. First, the synchronization issue between heterogeneous data captured by different sensors is addressed, and a straightforward synchronization procedure based on time delays affecting the samples is provided. Then, fall detection algorithms and a fall risk estimation tool based on Timed Up and Go (TUG) test, exploiting wearable Inertial Measurement Units (IMUs) and an RGB-Depth sensor (Microsoft Kinect) are proposed. The fall detection tool is evaluated on 11 healthy adults simulating 4 different falls and performing 4 activities of daily living, while the TUG is tested on 20 healthy subjects. Encouraging preliminary results are obtained with data acquired in laboratory environment. The tools are privacy preserving since only depth and skeleton information captured by Kinect are processed.",,,,8,"Synchronization, Inertial sensor, Fall risk estimation, Fall detection, Depth camera, Data fusion","Cippitelli, Enea; Gasparrini, Samuele; Gambi, Ennio; Spinsante, Susanna",9781450347488,Proceedings of the 7th International Conference on Software Development and Technologies for Enhancing Accessibility and Fighting Info-Exclusion,246–253,"Vila Real, Portugal",DSAI '16,
article,Privacy perception and fall detection accuracy for in-home video assistive monitoring with privacy enhancements,2012,September 2012,Association for Computing Machinery,"New York, NY, USA",2,2,https://doi.org/10.1145/2384556.2384557,10.1145/2384556.2384557,"Video of in-home activity provides valuable information for assistive monitoring but raises privacy concerns. Raw video can be privacy-enhanced by obscuring the appearance of a person. We consider five privacy enhancements: blur, silhouette, oval, box, and trailing-arrows. We investigate whether a privacy enhancement exists that provides sufficient perceived privacy while enabling accurate fall detection by humans. We recorded 23 1-minute videos involving normal household activities, falling, and lying on the floor after an earlier fall, and created versions of each video for each privacy setting. We conducted an experiment with 376 undergraduate, non-engineering student participants to measure perceived privacy protection and the participant's fall detection accuracy for each privacy setting. Results indicate that the oval provides sufficient perceived privacy for 88% of participants while still supporting fall detection accuracy of 89%, and that the common privacy enhancements blur and silhouette were perceived to provide insufficient privacy.",SIGHIT Rec.,September,,10,"video, smart home, privacy-enhanced video, privacy, assistive monitoring","Edgcomb, Alex; Vahid, Frank",,,6–15,,,
inproceedings,The Medical Use of Smartwatches: A Tertiary Study Comparing Northern and Southern European Nursing homes,2021,,Association for Computing Machinery,"New York, NY, USA",,,https://doi.org/10.1145/3486011.3486470,10.1145/3486011.3486470,"The European elderly population is increasing at a rapid rate. With the aging population, a shifted lifestyle and several healthcare needs follow due to non-communicable diseases, which could become both labour-intensive and expensive. However, with the advancement of technology in recent years, a new area of preventative monitoring has been developed, using wearables such as smartwatches within the healthcare field. The objectives of this study are threefold. First, investigate the average use of smartwatches within healthcare, and to which degree it is being used on patients. Second, to explore the differences between the medical use of smartwatches in nursing homes between northern and southern Europe. Third, measure the growth of the use of smartwatches within nursing homes. To do so, a systematic literature review was performed, covering the period from 2010 to 2021. Although, a total of 712 studies were retrieved, 16 were included in this review. The results show an overall positive assessment of the use of smartwatches within nursing homes, both in northern and southern Europe. However, there is a difference in use, based on the assessed needs, such as the difference between climates. The use of smartwatches within nursing homes has great potential, both within northern and southern Europe. Although the user's privacy and security are hardly discussed, both need to be a bigger concern.",,,,5,"Wearables, Systematic Review, Smartwatch, Nursing Home, Elders","Karlsen, Ida; Colomo-Palacios, Ricardo; Holone, Harald",9781450390668,Ninth International Conference on Technological Ecosystems for Enhancing Multiculturality (TEEM'21),330–334,"Barcelona, Spain",TEEM'21,
inproceedings,Towards a Blockchain based Fall Prediction Model for Aged Care,2019,,Association for Computing Machinery,"New York, NY, USA",,,https://doi.org/10.1145/3290688.3290736,10.1145/3290688.3290736,"Falls are one of the major health concerns for the elderly people. These falls often result in severe injuries which lead into huge medical expenses. Over the recent years, many ICT based fall detection and fall prevention solutions emerged to address the risk factors associated with falls. However, despite of these research studies, predicting the likelihood of falls still remains as a huge challenge in both medical and IT research domains. Data related to these risk factors being scattered among different healthcare providers can be attributed as a main reason for this challenge. This is further amplified by healthcare providers being reluctant to disseminate the data beyond their entities due to the security and privacy concerns. However, in recent years, blockchain has been proven as a promising technology to address the security and privacy challenges in healthcare data exchange as it provides a shared, immutable, and transparent audit trail for accessing data. Therefore, in this paper, we are going to propose a conceptual blockchain based fall prediction model leveraging smart contracts and FHIR (Fast Healthcare Interoperability Resources) standard to identify the elderly people who are at a higher risk of falling.",,,32,10,"Smart Contracts, Healthcare, Fall Prediction, Blockchain Technology","Rupasinghe, Tharuka; Burstein, Frada; Rudolph, Carsten; Strange, Steven",9781450366038,Proceedings of the Australasian Computer Science Week Multiconference,,"Sydney, NSW, Australia",ACSW '19,
inproceedings,DomAIn: Towards Programless Smart Homes,2025,,Association for Computing Machinery,"New York, NY, USA",,,https://doi.org/10.1145/3722570.3726888,10.1145/3722570.3726888,"We are far from the full adoption of smart home technologies, let alone realizing truly intelligent homes. There are many barriers preventing homeowners from fully adopting smart home technologies, chief among them being their low perceived usefulness (PU) and perceived ease of use (PEoU). Current smart home ecosystems and frameworks only support simple triggers and require homeowners to specify step-by-step logic or purchase new devices to automate new tasks, which severely limits the PU and PEoU of these technologies. We propose DomAIn, a smart home platform that automatically generates, programs, and deploys logic to satisfy a wide range of home-based tasks based on available devices in the home environment, without requiring users to manually ""program"" any logic. We demonstrate through real deployments and user studies that by incorporating DomAIn, a platform that reduces the need for users to program logic, we can significantly improve a variety of factors that affect PU and PEoU, such as customizability and complexity, by up to 38%, as well as satisfy a diverse range of tasks in home scenarios.",,,,6,"human-centered computing, smart home, task automation, usability, user study","Sui, Yueyuan; Zhang, Yiting; Liu, Yanchen; Zhao, Minghui; Hou, Kaiyuan; Nie, Jingping; Jiang, Xiaofan; Xia, Stephen",9798400716096,"Proceedings of the 3rd International Workshop on Human-Centered Sensing, Modeling, and Intelligent Systems",7–12,"Irvine, CA, USA",HumanSys '25,
