Item Type,title,year,issue_date,publisher,address,volume,number,url,doi,abstract,journal,month,articleno,numpages,keywords,Authors,isbn,booktitle,pages,location,series,issn
inproceedings,Optimization and Validation of a 2D-LiDAR-Coverage Algortihm,2025,,Association for Computing Machinery,"New York, NY, USA",,,https://doi.org/10.1145/3733155.3737907,10.1145/3733155.3737907,"The strategic placement of 2D-LiDAR (Light Detection and Ranging) sensors is critical for a wide range of applications in smart indoor environments, including security, fall detection, and elderly care monitoring. This paper introduces and validates a novel 2D-LiDAR coverage algorithm designed to address significant challenges such as blind spots and shadow minimization. By extending existing grid-based methodologies, the proposed algorithm incorporates multi-directional coverage requirements to ensure that each grid cell is reliably monitored from multiple perspectives. This enhancement reduces the likelihood of undetected areas and improves the overall resilience of the system to occlusions. Furthermore, the algorithm optimizes sensor placement to minimize hardware requirements while maintaining comprehensive spatial coverage. The algorithm’s performance is rigorously evaluated through both simulated and real-world experiments. The simulations modeled a typical and simple indoor environment with one large static obstacle to validate the effectiveness of the sensor placement strategy in achieving full coverage with minimal overlap. Real-world experiments, utilizing RPLidar A1M8 sensors, confirm the simulation results and demonstrate the practical feasibility of the algorithm in detecting and tracking movement throughout the test environment, including in regions prone to occlusions. These results emphasize the algorithm’s suitability for high-reliability applications such as fall detection in elderly care settings and continuous monitoring in smart environments. This work not only validates the practical applicability of the proposed approach but also provides a foundation for its adaptation to more complex scenarios, paving the way for advancements in sensor network design and deployment in diverse real-world contexts.",,,,7,"2D-LiDAR, Sensor Placement Optimization, Fall Detection, Indoor Monitoring, Shadow Minimization, Elderly Care Safety, Coverage Overlap, Real-world Validation, Smart Environment Monitoring","D'Avis, Noel; Faquiri, Silvia",9798400714023,Proceedings of the 18th ACM International Conference on PErvasive Technologies Related to Assistive Environments,248–254,,PETRA '25,
article,mmSeg: Leveraging mmWave Radar for Fine-grained Human Semantic Segmentation,2026,February 2026,Association for Computing Machinery,"New York, NY, USA",7,1,https://doi.org/10.1145/3786769,10.1145/3786769,"Human semantic segmentation facilitates the recognition of different parts of the human body and is essential for applications such as sports analysis and fall detection. To integrate human semantic segmentation into the domain of radio front-end sensing, this article introduces mmSeg, an innovative system that leverages commercial millimeter-wave radar for human semantic segmentation. However, the inherent propagation characteristics of mmWave signals often result in highly sparse point clouds with limited semantic information and the entanglement of temporal-topological features, making human semantic segmentation a challenging task. To address these challenges, mmSeg (i) first introduces a radar cross-section (RCS) calculation method suitable for commercial millimeter-wave radar to enhance the semantic information of radar point clouds at a coarse granularity; (ii) further designs a temporal-topological decoupling network to obtain the fine-grained human semantic segmentation results; (iii) constructs an efficient loss function for end-to-end training, based on an adjacency matrix graph to improve the segmentation performance. We evaluate mmSeg on our self-built millimeter-wave dataset HSS and a public dataset MM-Fi. mmSeg achieves an average point cloud segmentation accuracy of 87.74% on the HSS dataset and 84.18% on the MM-Fi dataset, outperforming the existing methods in both cases.",ACM Trans. Internet Things,February,10,32,"Millimeter-wave, human semantic segmentation, wireless sensing, radar cross-section","Shi, Ruili; Wang, Shuai; Mei, Luoyu; Zhang, Xuehan; Xu, Zhao-Dong; Wang, Shuai",,,,,,
inproceedings,“I Don’t Want to Become a Number’’: Examining Different Stakeholder Perspectives on a Video-Based Monitoring System for Senior Care with Inherent Privacy Protection (by Design).,2024,,Association for Computing Machinery,"New York, NY, USA",,,https://doi.org/10.1145/3613904.3642164,10.1145/3613904.3642164,"Active and Assisted Living (AAL) technologies aim to enhance the quality of life of older adults and promote successful aging. While video-based AAL solutions offer rich capabilities for better healthcare management in older age, they pose significant privacy risks. To mitigate the risks, we developed a video-based monitoring system that incorporates different privacy-preserving filters. We deployed the system in one assistive technology center and conducted a qualitative study with older adults and other stakeholders involved in care provision. Our study demonstrates diverse users’ perceptions and experiences with video-monitoring technology and offers valuable insights for the system’s further development. The findings unpack the privacy-versus-safety trade-off inherent in video-based technologies and discuss how the privacy-preserving mechanisms within the system mitigate privacy-related concerns. The study also identifies varying stakeholder perspectives towards the system in general and highlights potential avenues for developing video-based monitoring technologies in the AAL context.",,,774,19,"Active and Assisted Living, Ageing, Older Adults, Privacy Concerns, Qualitative Study, Video Monitoring System","Mujirishvili, Tamara; Fedosov, Anton; Hashemifard, Kooshan; Climent-P\'{e}rez, Pau; Florez-Revuelta, Francisco",9798400703300,Proceedings of the 2024 CHI Conference on Human Factors in Computing Systems,,"Honolulu, HI, USA",CHI '24,
inproceedings,Fall Detection Algorithm Based on Wearable Design,2025,,Association for Computing Machinery,"New York, NY, USA",,,https://doi.org/10.1145/3708657.3708738,10.1145/3708657.3708738,"As the world's aging problem intensifies, monitoring the physiological status of the elderly has become a hot issue of social concern. As an important method, body health monitoring based on wearable sensors has the characteristics of simplicity, efficiency, and low power consumption. Aiming at the data differentiation problem caused by different physiological data of different groups of people, a new feature space construction method is proposed, which introduces the concept of feature importance to minimize the complexity and calculation delay of feature calculation. In addition, a feedforward neural network is constructed to achieve secondary direction judgment after a fall to balance algorithm complexity and overall judgment accuracy. Simulation results show that compared with traditional neural network models, this algorithm has advantages in classification accuracy and model complexity, and has the potential to be deployed on small devices.",,,,7,"Fall detection, Neural networks, Threshold feature, Wearable device","Tian, Yunlong; Liu, Chang; Zhang, Xu; Zhang, Wentao; Li, Yonghua",9798400717444,Proceedings of the 2024 10th International Conference on Communication and Information Processing,492–498,,ICCIP '24,
inproceedings,Millimeter Wave Radar Fall Detection Algorithm Based on Improved Transformer,2023,,Association for Computing Machinery,"New York, NY, USA",,,https://doi.org/10.1145/3606193.3606195,10.1145/3606193.3606195,"Aiming at the defects of convolutional neural network that it is difficult to extract high-level visual semantic information and ignore inter-channel information, a millimeter wave radar fall detection algorithm based on improved Transformer is proposed. By combining the channel attention mechanism with the Transformer network structure to form a pyramid structure, the temporal information and spatial information of the signal are effectively extracted, the feature extraction ability of the deep learning network model is enhanced, and the problem of overfitting of the Transformer structure under small samples is improved. The fall detection of millimeter wave radar signal is realized. The experimental results show that the classification accuracy of the algorithm is 96.8%, which verifies the feasibility and effectiveness of the model.",,,,7,,"Bao, Zhiqiang; Ai, Ting; Su, Jinhang",9798400700040,Proceedings of the 2023 5th International Symposium on Signal Processing Systems,8–14,"Guangzhou, China",SSPS '23,
inproceedings,Simultaneous Real-Time Human Fall Detection and Reidentification Based on Multisensors Data,2022,,Association for Computing Machinery,"New York, NY, USA",,,https://doi.org/10.1145/3529190.3534728,10.1145/3529190.3534728,"Fall detection and reidentification are active areas of research with a wide variety of applications in many fields. Nowadays, wearable devices capable of recording multisensors measurements are being increasingly introduced in people’s daily lives, such as smartphones and smartwatches. Often, these devices are used in healthcare rehabilitation scenarios to monitor patients activities and, eventually, detect important events like falls. In some cases, the equipped Inertial Measurements Unit (IMU) lacks of gyroscope and magnetometer, allowing to acquire only accelerations measures. In this conditions, the detection tasks become more complex and many false detections can arise. Additionally, other methods, such as monitoring cameras, are usually used in the environment to overcome this problem and further track the patients. But, due to the lack of personal identifiers in the camera tracking system, it is not straightforward to associate falls, when detected, to a particular person. In this paper, we propose a complete real-time system to detect falls reducing false positives and simultaneously reidentify the patients using 3D skeleton points, given by a tracking camera, and 3-axis accelerometer data. Firstly, the system performs fall detection by means of a mathematical analysis of the skeleton points evolution along different frames. At the same time, fall detection is computed on the acceleration data using a Finite State Machine approach. If a fall is detected with both mechanisms, reidentification is carried out to associate the skeleton with the wearable device. A dataset of fall sequences has been recorded and is available for testing purposes. The final accuracy of our fall detection and reidentification algorithm is 100% on our dataset.",,,,6,"Reidentification, Multisensor Data, Matching, Fall detection, Accelerometer, 3D Skeleton Joints","Bastico, Matteo; Ruiz, Ver\'{o}nica; Belmonte-Hern\'{a}ndez, Alberto",9781450396318,Proceedings of the 15th International Conference on PErvasive Technologies Related to Assistive Environments,365–370,"Corfu, Greece",PETRA '22,
article,Toward Device-free and User-independent Fall Detection Using Floor Vibration,2023,February 2023,Association for Computing Machinery,"New York, NY, USA",19,1,https://doi.org/10.1145/3519302,10.1145/3519302,"The inevitable aging trend of the world’s population brings a lot of challenges to the health care for the elderly. For example, it is difficult to guarantee timely rescue for single-resided elders who fall at home. Under this circumstance, a reliable automatic fall detection machine is in great need for emergent rescue. However, the state-of-the-art fall detection systems are suffering from serious privacy concerns, having a high false alarm, or being cumbersome for users. In this article, we propose a device-free fall detection system, namely G-Fall, based on floor vibration collected by geophone sensors. We first decompose the falling mode and characterize it with time-dependent floor vibration features. By leveraging Hidden Markov Model (HMM), our system is able to detect the fall event precisely and achieve user-independent detection. It requires no training from the elderly but only an HMM template learned in advance through a small number of training samples. To reduce the false alarm rate, we propose a novel reconfirmation mechanism using Energy-of-Arrival (EoA) positioning to assist in detecting the human fall. Extensive experiments have been conducted on 24 human subjects. On average, G-Fall achieves a 95.74% detection precision on the anti-static floor and 97.36% on the concrete floor. Furthermore, with the assistance of EoA, the false alarm rate is reduced to nearly 0%.",ACM Trans. Sen. Netw.,February,5,20,"user-independent, device-free, geophone, floor vibration, Fall detection","Wu, Kaishun; Huang, Yandao; Qiu, Minghui; Peng, Zhenkan; Wang, Lu",,,,,,1550-4859
inproceedings,A Deep Learning Based Human Fall Detection Solution,2022,,Association for Computing Machinery,"New York, NY, USA",,,https://doi.org/10.1145/3529190.3529221,10.1145/3529190.3529221,"Automatic human fall detection is a challenging task in healthcare. Using deep learning models in conjunction with cameras have been proven to be more accurate and efficient in detecting falls in comparison to wearable technology and other more intrusive alternatives. In this paper, we propose a long-term recurrent convolutional network (LRCN) architecture for human fall detection, which consists of a custom convolutional neural network specifically designed to address the challenges of this task and the limited amount of available data, followed by a long short-term memory (LSTM) neural network which decodes sequential information to determine if there has been a fall. Performance evaluations show that our LRCN architecture outperforms the existing state-of-the-art method by 11.20%.",,,,4,"smart home, deep learning, Fall detection","Tohidypour, Hamid; Shojaei-Hashemi, Anahita; Nasiopoulos, Panos; Pourazad, Mahsa",9781450396318,Proceedings of the 15th International Conference on PErvasive Technologies Related to Assistive Environments,89–92,"Corfu, Greece",PETRA '22,
inproceedings,Research on the Application of Fall Detection Technology Based on the Security Field of the Smart Care for the Elderly,2022,,Association for Computing Machinery,"New York, NY, USA",,,https://doi.org/10.1145/3512826.3512832,10.1145/3512826.3512832,"Abstract. The security of the elderly in an aging society has become a social problem attracting much attention, among which the problem of secondary injury caused by the fall has attracted wide concern of researchers. The application of fall detection combined with artificial intelligence technology has become an important application in the security field of smart care for the elderly. After analyzing and judging the human body features, this paper found out that the combination of human skeleton and fall detection technology could be used to identify the fall behavior and link it with the alarm system to solve the security problem of smart care for the elderly. The experimental results showed that the recognition rate of fall detection was increased by 2% after adding optimization of genetic algorithm factors and contrast calculation of prediction frame length in the process of human feature target detection.",,,,5,"Keywords. Smart Care for the Elderly, Human Features, Genetic Algorithm, Fall Detection","Chen, Zhiwen; Ji, Yong; Ren, Yuanhong",9781450395489,Proceedings of the 2022 3rd International Conference on Artificial Intelligence in Electronics Engineering,75–79,"Bangkok, Thailand",AIEE '22,
inproceedings,Real-Time Privacy Preserving Human Activity Recognition on Mobile using 1DCNN-BiLSTM Deep Learning,2023,,Association for Computing Machinery,"New York, NY, USA",,,https://doi.org/10.1145/3591156.3591159,10.1145/3591156.3591159,"Human Activity Recognition (HAR) from sensors has real-world applications such as fall detection of elderly or improvement in human-robot interactions, but privacy is of concern in videos of such applications. We investigated the feasibility of developing a real-time HAR mobile application that detects 3 different human poses: standing, sitting and lying, while preserving privacy by a facial detection method that also masks faces in the video. We proposed a hybrid 1-Dimensional Convolutional Neural Network with Bidirectional Long Short-Term Memory (1DCNN-BiLSTM) algorithm to recognise these 3 poses. We trained our proposed 1DCNN-BiLSTM algorithm using RGB videos from 3 public datasets (URFall, NTU RGB+D, Fall Detection) whereby features were extracted using MoveNet. The results yielded 82.1% test accuracy and 0.930 macro average AUC-ROC score on the combined dataset, hence demonstrating feasibility of deploying the proposed algorithm for balanced as well as imbalanced datasets. We then implemented our proposed 1DCNN-BiLSTM algorithm with face detection and masking in a mobile application. The results showed that the mobile application could perform human pose detection inference in real time (3 people at 23.0-25.3 FPS). Hence this study showed promise of a larger scale-study of these HAR systems, such as monitoring potential falls in video surveillance.",,,,9,"Real-Time Mobile Application, Human Activity Recognition, Deep Learning, Computer Vision","Singh, Ishneet; Kaza, Pradyoth; Hosler, Peter; Chin, Zheng; Ang, Kai",9781450398381,"Proceedings of the 2023 5th International Conference on Image, Video and Signal Processing",18–26,"Singapore, Singapore",IVSP '23,
inproceedings,A Cross-dataset Evaluation of Wearable Fall Detection Systems,2022,,Association for Computing Machinery,"New York, NY, USA",,,https://doi.org/10.1145/3529190.3529191,10.1145/3529190.3529191,"The popularity of wearables and their seamless integration into our daily lives have transformed these devices into an appealing resource to deploy automatic fall detection systems. During last years, a massive literature on new methods and algorithms for these wearable detectors has been produced. However, in most cases these algorithms are tested against one single (or at best two) datasets containing signals captured from falls and conventional movements. This work evaluates the behavior of a fall detection system based on a convolutional neural network when different public repositories of movements are alternatively used for training and testing the model. After a systematic cross-dataset evaluation involving four well-known datasets, we show the difficulty of extrapolating the results achieved by a certain classifier for a particular database when another dataset is considered. Results seem to indicate that classification methods tend to overlearn the particular conditions (typology of movements, characteristics of the employed sensor, experimental subjects) under which the training samples were generated.",,,,6,"Wearables, Fall Detection System, Cross-dataset evaluation, Convolutional Neural Networks, Accelerometer","Santoyo-Ram\'{o}n, Jose; Casilari, Eduardo; Cano-Garc\'{\i}a, Jose",9781450396318,Proceedings of the 15th International Conference on PErvasive Technologies Related to Assistive Environments,1–6,"Corfu, Greece",PETRA '22,
inproceedings,TADAR: Thermal Array-based Detection and Ranging for Privacy-Preserving Human Sensing,2024,,Association for Computing Machinery,"New York, NY, USA",,,https://doi.org/10.1145/3641512.3686357,10.1145/3641512.3686357,"Human sensing has gained increasing attention in various applications. Among the available technologies, visual images offer high accuracy, while sensing on the RF spectrum preserves privacy, creating a conflict between imaging resolution and privacy preservation. In this paper, we explore thermal array sensors as an emerging modality that strikes an excellent resolution-privacy balance for ubiquitous sensing. To this end, we present TADAR, the first multi-user Thermal Array-based Detection and Ranging system that estimates the inherently missing range information, extending thermal array outputs from 2D thermal pixels to 3D depths and empowering them as a promising modality for ubiquitous privacy-preserving human sensing. We prototype TADAR using a single commodity thermal array sensor and conduct extensive experiments in different indoor environments. Our results show that TADAR achieves a mean F1 score of 88.8% for multi-user detection and a mean accuracy of 32.0 cm for multi-user ranging, which further improves to 20.1 cm for targets located within 3 m. We conduct two case studies on fall detection and occupancy estimation to showcase the potential applications of TADAR. We hope TADAR will inspire the vast community to explore new directions of thermal array sensing, beyond wireless and acoustic sensing. TADAR is open-sourced on GitHub: https://github.com/aiot-lab/TADAR.",,,,10,"human sensing, thermal array, detection and ranging","Zhang, Xie; Wu, Chenshu",9798400705212,"Proceedings of the Twenty-Fifth International Symposium on Theory, Algorithmic Foundations, and Protocol Design for Mobile Networks and Mobile Computing",11–20,"Athens, Greece",MobiHoc '24,
inbook,Research on the Application of Multi-source Data Fusion in Smart Elderly Care Health Monitoring Systems,2026,,Association for Computing Machinery,"New York, NY, USA",,,https://doi.org/10.1145/3777577.3777597,,"The field of smart elderly care faces challenges posed by the limitations of traditional monitoring methods and data fragmentation. Multi-source data fusion technology offers a novel approach to addressing fragmented health monitoring. This study focuses on home-based care scenarios, integrating data from wearable devices, environmental sensors, and health records to construct a dynamic collaborative monitoring framework. By leveraging the complementary strengths of heterogeneous data, this framework breaks down information silos, aiming to enhance response speed to abnormal events and improve the precision of chronic disease management. The technological core centers on feature-level fusion and lightweight privacy protection mechanisms, providing a practical technical solution to meet the health service demands of an aging society.",,,,7,,"Bai, Xiao; Peng, Nianjiao; Zhou, Fangfang; Guo, Cheng; Wei, Qianwen; Luo, Yingqi; Lu, Rongzhen",9798400715112,Proceedings of the 2025 6th International Symposium on Artificial Intelligence for Medical Sciences,125–131,,,
article,Waffle: A Waterproof mmWave-based Human Sensing System inside Bathrooms with Running Water,2024,December 2023,Association for Computing Machinery,"New York, NY, USA",7,4,https://doi.org/10.1145/3631458,10.1145/3631458,"The bathroom has consistently ranked among the most perilous rooms in households, with slip and fall incidents during showers posing a critical threat, particularly to the elders. To address this concern while ensuring privacy and accuracy, the mmWave-based sensing system has emerged as a promising solution. Capable of precisely detecting human activities and promptly triggering alarms in response to critical events, it has proved especially valuable within bathroom environments. However, deploying such a system in bathrooms faces a significant challenge: interference from running water. Similar to the human body, water droplets reflect substantial mmWave signals, presenting a major obstacle to accurate sensing. Through rigorous empirical study, we confirm that the interference caused by running water adheres to a Weibull distribution, offering insight into its behavior. Leveraging this understanding, we propose a customized Constant False Alarm Rate (CFAR) detector, specifically tailored to handle the interference from running water. This innovative detector effectively isolates human-generated signals, thus enabling accurate human detection even in the presence of running water interference. Our implementation of ""Waffle"" on a commercial off-the-shelf mmWave radar demonstrates exceptional sensing performance. It achieves median errors of 1.8cm and 6.9cm for human height estimation and tracking, respectively, even in the presence of running water. Furthermore, our fall detection system, built upon this technique, achieves remarkable performance (a recall of 97.2% and an accuracy of 97.8%), surpassing the state-of-the-art method.",Proc. ACM Interact. Mob. Wearable Ubiquitous Technol.,January,201,29,"Bathroom, Fall Detection, Radar Point cloud, Target Detection, mmWave Radar Sensing","Zhang, Xusheng; Zhang, Duo; Xie, Yaxiong; Wu, Dan; Li, Yang; Zhang, Daqing",,,,,,
