Item Type,title,year,issue_date,publisher,address,volume,number,url,doi,abstract,journal,month,articleno,numpages,keywords,Authors,isbn,booktitle,pages,location,series,issn
inproceedings,Elderly Smart Home Development Research and Design Exploration,2024,,Association for Computing Machinery,"New York, NY, USA",,,https://doi.org/10.1145/3644116.3644231,10.1145/3644116.3644231,"The current research status of smart home for the elderly is sorted out, current research directions and cutting-edge technologies used are summarized, and the future development direction of smart home for the elderly in China is speculated. The research analysis shows that the current research on smart home for the elderly focuses on four aspects, namely, home care and health monitoring, daily life assistance, interaction design and user acceptance research, and integrates technologies such as virtual reality and blockchain into it, so that the elderly can experience the convenience that smart technology brings to aging at home. Based on the current situation that the research on smart home for the elderly in China focuses on the level of design innovation and theoretical research, it is proposed that Based on the current situation that the research on smart home for the elderly in China focuses on design innovation and theoretical research, it is proposed that the future research on smart home for the elderly should develop in the direction of designing the system to adapt to aging and improving the economy of the product, improving the acceptance and safety of the product, and paying attention to the physiological health and psychological health of users.",,,,6,,"Xue, Yanmin; Shi, Yuting",9798400708138,Proceedings of the 2023 4th International Symposium on Artificial Intelligence for Medicine Science,694–699,"Chengdu, China",ISAIMS '23,
inproceedings,Wearable Activity Trackers Supporting Elderly Living Independently: A Standards based Approach for Data Integration to Health Information Systems,2018,,Association for Computing Machinery,"New York, NY, USA",,,https://doi.org/10.1145/3218585.3218679,10.1145/3218585.3218679,"Preserving independence is of high importance for aging adults. Information Technology based solutions in the context of ""elderly living independently"" and ""ambient assisted living"" provide support to increase factors like emotional security, physical activity and general well-being. It is expected that wearable activity trackers positively influence these factors. Hence, this work investigated the integration of wearable activity trackers into medical IT systems from the perspective of technical interoperability, as this is a key feature to improve quality and reliability of both the system itself and the health related data. Based on a previously conducted market analysis, investigating the most prominent wearable activity trackers on their communication interfaces, an medical interoperability standards based approach for data integration to medical information systems was proposed and prototypically implemented to study feasibility. The prototype was successfully validated with interoperability tests against the specification of HL7 FHIR to align with the Personal Connected Health Alliance (PCHA) guidelines. The results showed that the implementation of the interoperability standard HL7 FHIR for this purpose was possible and could be used as an approach to integrate several manufacturer independent wearable activity trackers in a common system to increase flexibility and extensibility. The quality of the data can be increased as it is syntactically and semantically structured according to the HL7 FHIR specification, which may facilitate more reliable approaches for automated fall detection or emergency alarms as a follow-up. However, to fulfill the requirements of semantical interoperability a value-set was defined. Summarizing, without change of thinking and more effort on the manufacturers side to change proprietary communication interfaces (which still is the case to a very high degree) to standardized ones, the advantages based on using interoperability standards can't be effective.",,,,8,"eHealth, Wearable Activity Tracker, Personal Health Record, Personal Health Devices, Interoperability, Health Information Exchange, Elderly Living Independently","Urbauer, Philipp; Frohner, Matthias; David, Veronika; Sauermann, Stefan",9781450364676,Proceedings of the 8th International Conference on Software Development and Technologies for Enhancing Accessibility and Fighting Info-Exclusion,302–309,"Thessaloniki, Greece",DSAI '18,
inproceedings,Design and implementation of intelligent security monitoring system based on RPA+AI,2024,,Association for Computing Machinery,"New York, NY, USA",,,https://doi.org/10.1145/3650400.3650645,10.1145/3650400.3650645,"RPA+AI is a combination of RPA technology and AI technology. Experts have long predicted that the relationship between RPA and AI is the same as the relationship between human hands and feet and brain, with RPA being the hands and feet associated with ""hands"" and AI being the brain associated with ""thinking"" and ""learning."" With the development of science and technology, surveillance cameras have been applied to every corner of life, especially in the construction of Hainan free trade port, the application of monitoring system is more and more extensive. However, the rapid development of surveillance cameras has also brought many problems, for example: the number of surveillance cameras in businesses or schools can reach hundreds. When there is a problem and you want to view the playback of the monitoring, it is not only time-consuming and laborious, but also easy to produce visual fatigue. There are many such application scenarios, all of which, to varying degrees, require manual handling of tedious process work. This paper focuses on the deployment of RPA robots in these application scenarios. By cooperating with artificial intelligence, replacing the repetitive and monotonous screening and search work in the monitoring system, human error can be reduced to a certain extent, operating efficiency can be improved, and operating costs can be reduced. This paper takes traditional camera intelligence as an example, based on RPA, AI and machine vision technology, studies how to apply machine vision technology to traditional surveillance cameras, transform traditional surveillance cameras into intelligent surveillance cameras, and make effective information retrieval more convenient.",,,,8,,"Shi, Jinmei; Ye, Peng; Feng, Junying; Zhao, Qingcheng",9798400708305,Proceedings of the 2023 7th International Conference on Electronic Information Technology and Computer Engineering,1459–1466,"Xiamen, China",EITCE '23,
inproceedings,Personnel status detection model suitable for vertical federated learning structure,2022,,Association for Computing Machinery,"New York, NY, USA",,,https://doi.org/10.1145/3523150.3523166,10.1145/3523150.3523166,"With the improvement of the medical system, the universal access of wearable devices and people's greater concern about personal health, personnel health detection has received greater attention. However, existing personnel status detection faces the problem that existing models cannot get more accurate results by multiple types of data because the data is difficult to obtain across domains due to privacy issue. In this paper, we propose a vertical federated learning model for person status detection using multimodal data. Considering the varying compute capability of training devices and the different inference speed caused by modality complexity, a lightweight feature extraction sub-model is used, while ensuring data privacy and tolerating accuracy degradation. Also, we design a Fast and Secure (FS) module that effectively reduces the amount of data onto the network transmission process, the model's dependence on the network and the risk of data being intercepted by the third party. Experiment results demonstrate the feasibility of multimodal vertical federated learning and the accuracy is increased by 5.6 percentage points compared with unimodal. The FS module reduces the amount of network transmission information by 50% and 48.1% during model use and model training, respectively",,,,7,"Vertical federated learning, Personnel status detection, Multi-modal","Ji, Jie; Yan, Danfeng; Mu, Zhengyang",9781450387477,Proceedings of the 2022 6th International Conference on Machine Learning and Soft Computing,98–104,"Haikou, China",ICMLSC '22,
inproceedings,"Exploiting pervasive leaked EM signals for communication, charging and sensing",2024,,Association for Computing Machinery,"New York, NY, USA",,,https://doi.org/10.1145/3643832.3661390,10.1145/3643832.3661390,"Since the first successful wireless transmission across the Bristol Channel in 1897, wireless technologies have revolutionized the way we live, work and interact with the world. Besides the traditional communication function (e.g., Wi-Fi), wireless signals are further utilized for other functions such as localization, sensing and even charging. While promising in many aspects, one critical issue associated with these new functions is that they require dedicated signal transmissions, which interfere the original communication function. Take popular Wi-Fi sensing as the example. 200-1000 dedicated Wi-Fi packets per second need to be transmitted to enable Wi-Fi sensing which significantly decrease the throughput of ongoing Wi-Fi communication.Thus, I ask this question: ""can we utilize ambient, non-dedicated wireless signals to realize the aforementioned functions?"" For my Ph.D thesis, I harness the pervasive ambient leakage signals traditionally considered detrimental to enhance the performance of wireless communication and enable new functions such as sensing and charging. My thesis is inspired by the key observation that there exist a large amount of leakage RF signals in our surroundings. For example, the powerlines continuously emit out 50/60 Hz electromagnetic (EM) signals due to the alternating current flowing inside. The operation of electric vehicles leaks RF signals in th frequency range of hundreds of hertz. One of the key wireless technologies in the next generation 6G networks, i.e., visible light communication (VLC) which relies on quickly turning ON/OFF the LED light also emit out RF leakages due to the quick ON/OFF state change. In my thesis, through novel designs across both hardware and software, I turn these ambient leakages from foes to friends.Enhancing the security and throughput of wireless communication. Visible Light Communication is considered a key component of the 6G networks owing to its potential high data rates, pervasiveness of commodity LEDs, and minimal interference on existing RF communication. For the first time, we showed that during the transmission of VLC, the transmitter not only emits out visible light signals but also leaks out RF signals [1]. The underlying principle behind this leaked signal is the intensity modulation scheme commonly adopted in VLC systems. As illustrated in Figure 1, in VLC, data bits '0' and '1' are represented by switching 'OFF' and 'ON' the LED, which leads to quick alterations of the current flow. These changing electric currents induce EM signal leakages. We developed a theoretical model to quantify the relationship between the amplitude of these leaked RF signals and the ON/OFF frequency. We show that while LED light signals can be easily constrained within an area of interest (e.g., a room with walls), the leakage RF signal can penetrate through walls. What's more interesting is that the leakage RF signal contains a copy of the data transmitted in the light signals and this finding renders VLC-the generally believed most secure wireless technology-not secure any more as illustrated in Figure 2. Building upon this finding, we further demonstrate a novel utilization of these leaked signals for carrying extra data [2] to double the data rate of existing VLC systems. In this design, data is transmitted through the leaked RF signal without a dedicated active RF front-end, reducing both power and hardware costs. We show through experiment that the free leaked RF signals can be leveraged to transmit extra data at a data rate even higher than the primary VLC channel.Harvesting the leaked energy for far-field charging. Following the successful utilization of VLC leakage signals for communication, we further view the leaked signals as a form of wasted energy and devote our effort to harvesting it [3]. The key observation enabling us to achieve this objective is that the surrounding objects can help significantly boost the amount of energy harvested. What is more exciting is that not just the ordinary objects such as walls and furniture can help enhance energy harvesting, the human body can also increase the amount of harvested energy. When the receiver antenna is in contact with a human body, the amount of harvested energy is increased by more than ten times. Based on this key observation, we propose our system, Bracelet+, which involves human body into the ecosystem of energy harvesting for the first time as depicted in Figure 3. We design the coil antenna as a bracelet so a person can wear it comfortably. The harvested power can reach up to micro-watts, holding promise for powering low-power body sensors and enabling body sensor network. Note that this far-field (i.e., a separation of a few meters between the target and the power source) wireless charging modality is very different from existing near-field wireless charging with the target and power source separated by just a few centimeters.Enabling a novel sensing modality. After we successfully utilized leaked signals for communication and charging, we move forward to utilize the leaked signals (i.e., the powerline leakage) for sensing purposes [4]. This electromagnetic leakage, stemming from alternating current in powerlines, is governed by Maxwell's Equations. However, the ultra-low frequency (60 Hz) of the leakage renders existing wireless sensing models inapplicable. Specifically, current wireless sensing modalities rely on the fact that signal propagation is affected by human's motions and thus by analyzing the induced signal variation, the information of the human motion can be inferred. However, for leaked signal which is extremely low-frequency, the propagation of the signal is not affected by human motions. Owing to the antenna's unique property (i.e., coil shape) for low frequency signals, we design the antenna as a ring and combine the human target and ring antenna together as a ""human antenna"" as shown in 4(a) to sense the human target's gesture. Although the human target's gesture does not affect the signal propagation, it affects the antenna and accordingly affects the received signal. We can thus utilize the signal variation for sensing. One unique advantage of this sensing modality is that although the ring is only in contact with the target's finger, it can sense the motion of the whole body. This new sensing modality is demonstrated to be able to support a large range of sensing applications such as gesture recognition, sleep posture sensing, and fall detection.Besides powerline leakage, we also leverage the EM leakage from electric vehicles (EVs) to enable in-vehicle sensing [5]. We observe that numerous components within the EVs including battery, powerline, and power inverter, emit EM signals during their operation. We thus use the leakage to sense the body motions of the driver/passenger without any dedicated signal transmitters. To address the unique challenge in car environment, i.e., the interfering car motions, we adopt a reference tag design, making the proposed sensing modality practical in real-world settings. Extensive experiments with a driving distance of 4000 kilometers under diverse real-world road conditions show that the proposed sensing system can achieve an accuracy over 90% in recognizing body motions solely utilizing ambient leakage signals.To summarize, we innovatively utilize pervasive leakage signals for wireless communication, far-field charging, and wireless sensing, achieving the following contributions:• We explored different types of leakage signals in our surroundings and demonstrated the application of the ""bad"" leakage signals in communication, charging and sensing.• Through deeply understanding the signal characteristics, we propose models to lay the theoretical foundation for utilizing the leakage signals for communication, charging and sensing.",,,,2,"leaked signal, wireless communication, wireless sensing, far-field charging","Cui, Minhao",9798400705816,"Proceedings of the 22nd Annual International Conference on Mobile Systems, Applications and Services",760–761,"Minato-ku, Tokyo, Japan",MOBISYS '24,
inproceedings,"Recognizing the Age, Gender, and Mobility of Pedestrians in Smart Cities using a CNN-BGRU on Thermal Images",2022,,Association for Computing Machinery,"New York, NY, USA",,,https://doi.org/10.1145/3524458.3547235,10.1145/3524458.3547235,"In order to extend ambient assisted living technologies for semi-autonomous people from smart homes to smart cities, it is necessary to recognize vulnerable people in the city. Gait-based approaches have been used to perform soft biometrics recognition, such as age or gender. However, most of these approaches rely on the use of RGB cameras, which can lead to serious privacy issues in the city. In this paper, we present an approach to perform age, gender, and mobility recognition on pedestrians in the city using thermal cameras, thus ensuring a high degree of privacy for the citizens. This work is a follow-up to an initial shallow CNN-based approach. A deeper CNN is optimized and used to perform age, gender, and mobility recognition on a single image before extending this approach to a sequence of images using a CNN-BGRU for age and gender recognition. The results obtained using these approaches are presented before discussing the social implications of a real-time gait-based soft biometrics recognition system in the city using thermal cameras. The system has achieved an accuracy of 77.00%, 78.46%, and 94.77% respectively for age, gender and mobility recognition using unprocessed 160x120 thermal images containing a majority of partial pedestrians silhouettes in the city.",,,,7,"thermal images, soft biometrics, rnn, raspberry pi, mobility, gender, gait recognition, deep learning, computer vision, cnn, age","Baghezza, Rani; Bouchard, K\'{e}vin; Gouin-Vallerand, Charles",9781450392846,Proceedings of the 2022 ACM Conference on Information Technology for Social Good,48–54,"Limassol, Cyprus",GoodIT '22,
inproceedings,Controlling Security Rules Using Natural Dialogue: an Application to Smart Home Care,2021,,Association for Computing Machinery,"New York, NY, USA",,,https://doi.org/10.1145/3460418.3479331,10.1145/3460418.3479331,"Smart home systems have revolutionized the way we interact with our living environment, but the concerns over sensor data privacy and security have become one of the major barriers to their widespread adoption. Despite a considerable research effort in designing secure access control mechanisms, the end users are still reluctant to use those either due to the complexity of the interfaces or because they do not have sufficient skills. For the elderly users the problem gets worse. Making the right security choices is increasingly more difficult for this group of users. To assist the elderly users in defining their access control policies, we design a dialogue-based system which allows to create new security rules or update existing ones in a simple and intelligible way using natural language and familiar terms.",,,,4,"voice assistant, smart home, privacy, elderly, access control","Goffinet, Stanley; Schmitz, Donatien; Zavalyshyn, Igor; Legay, Axel; Riviere, Etienne",9781450384612,Adjunct Proceedings of the 2021 ACM International Joint Conference on Pervasive and Ubiquitous Computing and Proceedings of the 2021 ACM International Symposium on Wearable Computers,194–197,"Virtual, USA",UbiComp/ISWC '21 Adjunct,
inproceedings,PECAM: privacy-enhanced video streaming and analytics via securely-reversible transformation,2021,,Association for Computing Machinery,"New York, NY, USA",,,https://doi.org/10.1145/3447993.3448618,10.1145/3447993.3448618,"As Video Streaming and Analytics (VSA) systems become increasingly popular, serious privacy concerns have risen on exposing too much unnecessary private information to the VSA providers. Yet, it is challenging to protect privacy while still preserving desired VSA features, i.e., effective analytics, forensic support, resource efficiency, and real-time execution. In this paper, we present a VSA privacy enhancement system (PECAM), which addresses the above challenge with no change in the VSA back-end. PECAM leverages a novel Generative Adversarial Network to perform the privacy-enhanced securely-reversible video transformation. PECAM also incorporates a couple of system optimizations into its VSA workflow to reduce network bandwidth usage and enable real-time processing on cameras. We implement our PECAM prototype on commodity hardware and evaluate its performance via both security study and extensive experiments. Results demonstrate that PECAM can effectively enhance the visual privacy of VSA in the presence of an adversary, and its transformed videos, when taken as input for various VSA back-end tasks, maintain a 96% accuracy of corresponding original videos. Additionally, it performs 12.3\texttimes{} and 1.8\texttimes{} better than baseline methods in terms of the computing cost and network bandwidth usage, respectively.",,,,13,"video streaming, video privacy, video analytics, securely-reversible transformation, GAN","Wu, Hao; Tian, Xuejin; Li, Minghao; Liu, Yunxin; Ananthanarayanan, Ganesh; Xu, Fengyuan; Zhong, Sheng",9781450383424,Proceedings of the 27th Annual International Conference on Mobile Computing and Networking,229–241,"New Orleans, Louisiana",MobiCom '21,
inproceedings,A Review of Machine Learning and TinyML in Healthcare,2022,,Association for Computing Machinery,"New York, NY, USA",,,https://doi.org/10.1145/3503823.3503836,10.1145/3503823.3503836,"Healthcare is the field that can benefit from the large amount of raw data generated from portable and wearable devices. This data must be sent to the Cloud for processing due to the computationally intensive nature of current state-of-the-art implementations of Neural Networks. The emerging technology of TinyML is an alternative approach proposed by the scientific community to create autonomous and safe devices that can collect, process, and alert without transmitting data to external entities. This work is the review of the contribution of the emerging technology of TinyML in healthcare applications at the edge, requiring the integration of Machine Learning algorithms, followed by the solutions it can bring, especially in wearable devices. Moreover, it is discussed how TinyML can optimize Neural Networks to bring intelligence and autonomy in devices used in fields such as healthcare.",,,,5,"TinyML, Neural Networks, Machine Learning, Healthcare, Embedded systems","Tsoukas, Vasileios; Boumpa, Eleni; Giannakas, Georgios; Kakarountas, Athanasios",9781450395557,Proceedings of the 25th Pan-Hellenic Conference on Informatics,69–73,"Volos, Greece",PCI '21,
article,Accurate and Efficient Algorithms that Adapt to Privacy-Enhanced Video for Improved Assistive Monitoring,2013,October 2013,Association for Computing Machinery,"New York, NY, USA",4,3,https://doi.org/10.1145/2523025.2523026,10.1145/2523025.2523026,"Automated monitoring algorithms operating on live video streamed from a home can effectively aid in several assistive monitoring goals, such as detecting falls or estimating daily energy expenditure. Use of video raises obvious privacy concerns. Several privacy enhancements have been proposed such as modifying a person in video by introducing blur, silhouette, or bounding-box. Person extraction is fundamental in video-based assistive monitoring and degraded in the presence of privacy enhancements; however, privacy enhancements have characteristics that can opportunistically be adapted to. We propose two adaptive algorithms for improving assistive monitoring goal performance with privacy-enhanced video: specific-color hunter and edge-void filler. A nonadaptive algorithm, foregrounding, is used as the default algorithm for the adaptive algorithms. We compare nonadaptive and adaptive algorithms with 5 common privacy enhancements on the effectiveness of 8 automated monitoring goals. The nonadaptive algorithm performance on privacy-enhanced video is degraded from raw video. However, adaptive algorithms can compensate for the degradation. Energy estimation accuracy in our tests degraded from 90.9% to 83.9%, but the adaptive algorithms significantly compensated by bringing the accuracy up to 87.1%. Similarly, fall detection accuracy degraded from 1.0 sensitivity to 0.86 and from 1.0 specificity to 0.79, but the adaptive algorithms compensated accuracy back to 0.92 sensitivity and 0.90 specificity. Additionally, the adaptive algorithms were computationally more efficient than the nonadaptive algorithm, averaging 1.7% more frames processed per second.",ACM Trans. Manage. Inf. Syst.,October,14,16,"Assistive monitoring, embedded systems, privacy-enhanced video, smart homes, telehealth, ubiquitous systems","Edgcomb, Alex; Vahid, Frank",,,,,,2158-656X
