Item Title,Publication Title,Book Series Title,Journal Volume,Journal Issue,Item DOI,Authors,Publication Year,URL,Content Type
"AI-big data analytics for building automation and management systems: a survey, actual challenges and future perspectives",Artificial Intelligence Review,,,,10.1007/s10462-022-10286-2,Yassine HimeurMariam ElnourFodil FadliNader MeskinIoan PetriYacine RezguiFaycal BensaaliAbbes Amira,2022,https://link.springer.com/article/10.1007/s10462-022-10286-2,Article
A novel approach for spam detection using horse herd optimization algorithm,Neural Computing and Applications,,,,10.1007/s00521-022-07148-x,Ali HosseinalipourReza Ghanbarzadeh,2022,https://link.springer.com/article/10.1007/s00521-022-07148-x,Article
A systematic review and research challenges on phishing cyberattacks from an electroencephalography and gaze-based perspective,Personal and Ubiquitous Computing,,,,10.1007/s00779-024-01794-9,George A. ThomopoulosDimitrios P. LyrasChristos A. Fidas,2024,https://link.springer.com/article/10.1007/s00779-024-01794-9,Article
Measuring responsible artificial intelligence (RAI) in banking: a valid and reliable instrument,AI and Ethics,,,,10.1007/s43681-023-00321-5,John RatzanNoushi Rahman,2023,https://link.springer.com/article/10.1007/s43681-023-00321-5,Article
Unmanned aerial vehicles (UAVs): an adoptable technology for precise and smart farming,Discover Internet of Things,,,,10.1007/s43926-024-00066-5,Swetha MakamBharath Kumar KomatineniSanwal Singh MeenaUrmila Meena,2024,https://link.springer.com/article/10.1007/s43926-024-00066-5,Article
A systematic mapping on software testing for blockchains,Cluster Computing,,,,10.1007/s10586-024-04421-7,Anıl ElakaşHasan SözerIlgın ŞafakKübra Kalkan,2024,https://link.springer.com/article/10.1007/s10586-024-04421-7,Article
Enhancing trust transfer in supply chain finance: a blockchain-based transitive trust model,Journal of Cloud Computing,,,,10.1186/s13677-023-00557-w,Chang ShuYuling ChenChaoyue TanYun LuoHui Dou,2024,https://link.springer.com/article/10.1186/s13677-023-00557-w,Article
High imperceptibility and robustness watermarking scheme for brain MRI using Slantlet transform coupled with enhanced knight tour algorithm,Multimedia Tools and Applications,,,,10.1007/s11042-023-16459-7,Hoshang KolivandTan Chi WeeShiva AsadianfamMohd Shafry RahimGhazali Sulong,2023,https://link.springer.com/article/10.1007/s11042-023-16459-7,Article
An optimized neural network with AdaHessian for cryptojacking attack prediction for Securing Crypto Exchange Operations of MEC applications,Journal of Cloud Computing,,,,10.1186/s13677-024-00630-y,Uma RaniSunil KumarNeeraj DahiyaKamna SolankiShanu Rakesh KuttanSajid ShahMomina ShaheenFaizan Ahmad,2024,https://link.springer.com/article/10.1186/s13677-024-00630-y,Article
International governance of advancing artificial intelligence,AI & SOCIETY,,,,10.1007/s00146-024-02050-7,Nicholas Emery-XuRichard JordanRobert Trager,2024,https://link.springer.com/article/10.1007/s00146-024-02050-7,Article
"Artificial Intelligence for Cognitive Health Assessment: State-of-the-Art, Open Challenges and Future Directions",Cognitive Computation,,,,10.1007/s12559-023-10153-4,Abdul Rehman JavedAyesha SaadiaHuma MughalThippa Reddy GadekalluMuhammad RizwanPraveen Kumar Reddy MaddikuntaMufti MahmudMadhusanka LiyanageAmir Hussain,2023,https://link.springer.com/article/10.1007/s12559-023-10153-4,Article
Intelligent integrated sensing and communication: a survey,Science China Information Sciences,,,,10.1007/s11432-024-4205-8,Jifa ZhangWeidang LuChengwen XingNan ZhaoNaofal Al-DhahirGeorge K. KaragiannidisXiaoniu Yang,2024,https://link.springer.com/article/10.1007/s11432-024-4205-8,Article
Cloud storage cost: a taxonomy and survey,World Wide Web,,,,10.1007/s11280-024-01273-4,Akif Quddus KhanMihhail MatskinRadu ProdanChristoph BusslerDumitru RomanAhmet Soylu,2024,https://link.springer.com/article/10.1007/s11280-024-01273-4,Article
Generative artificial intelligence: a systematic review and applications,Multimedia Tools and Applications,,,,10.1007/s11042-024-20016-1,Sandeep Singh SengarAffan Bin HasanSanjay KumarFiona Carroll,2024,https://link.springer.com/article/10.1007/s11042-024-20016-1,Article
ERG-AI: enhancing occupational ergonomics with uncertainty-aware ML and LLM feedback,Applied Intelligence,,,,10.1007/s10489-024-05796-1,Sagar SenVictor GonzalezErik Johannes HusomSimeon TverdalShukun TokasSvein O Tjøsvoll,2024,https://link.springer.com/article/10.1007/s10489-024-05796-1,Article
Innovative deep learning techniques for monitoring aggressive behavior in social media posts,Journal of Cloud Computing,,,,10.1186/s13677-023-00577-6,Huimin HanMuhammad AsifEmad Mahrous AwwadNadia SarhanYazeed Yasid GhadiBo Xu,2024,https://link.springer.com/article/10.1186/s13677-023-00577-6,Article
The Ethics of Artificial Intelligence for Intelligence Analysis: a Review of the Key Challenges with Recommendations,Digital Society,,,,10.1007/s44206-023-00036-4,Alexander BlanchardMariarosaria Taddeo,2023,https://link.springer.com/article/10.1007/s44206-023-00036-4,Article
Challenges in remote sensing based climate and crop monitoring: navigating the complexities using AI,Journal of Cloud Computing,,,,10.1186/s13677-023-00583-8,Huimin HanZehua LiuJiuhao LiZhixiong Zeng,2024,https://link.springer.com/article/10.1186/s13677-023-00583-8,Article
Algorithmic fairness in predictive policing,AI and Ethics,,,,10.1007/s43681-024-00541-3,Ahmed S. AlmasoudJamiu Adekunle Idowu,2024,https://link.springer.com/article/10.1007/s43681-024-00541-3,Article
Enhancing Generalization in Few-Shot Learning for Detecting Unknown Adversarial Examples,Neural Processing Letters,,,,10.1007/s11063-024-11572-6,Wenzhao LiuWanli ZhangKuiwu YangYue ChenKaiwei GuoJianghong Wei,2024,https://link.springer.com/article/10.1007/s11063-024-11572-6,Article
A phenomenological perspective on AI ethical failures: The case of facial recognition technology,AI & SOCIETY,,,,10.1007/s00146-023-01648-7,Yuni WenMatthias Holweg,2023,https://link.springer.com/article/10.1007/s00146-023-01648-7,Article
Specifying a principle of cryptographic justice as a response to the problem of going dark,Ethics and Information Technology,,,,10.1007/s10676-023-09707-9,Michael Wilson,2023,https://link.springer.com/article/10.1007/s10676-023-09707-9,Article
Explainable offline automatic signature verifier to support forensic handwriting examiners,Neural Computing and Applications,,,,10.1007/s00521-023-09192-7,Moises DiazMiguel A. FerrerGennaro Vessio,2023,https://link.springer.com/article/10.1007/s00521-023-09192-7,Article
Deep security analysis of program code,Empirical Software Engineering,,,,10.1007/s10664-021-10029-x,Tim SonnekalbThomas S. HeinzePatrick Mäder,2021,https://link.springer.com/article/10.1007/s10664-021-10029-x,Article
Classification bullying/cyberbullying through smartphone sensor and a questionnaire application,Multimedia Tools and Applications,,,,10.1007/s11042-023-17609-7,Vito Nicola ConvertiniVincenzo GattulliDonato ImpedovoGrazia Terrone,2023,https://link.springer.com/article/10.1007/s11042-023-17609-7,Article
Digital Pathology Scanners and Contextual Integrity,Digital Society,,,,10.1007/s44206-023-00085-9,Tom SorellRicky Z. Li,2023,https://link.springer.com/article/10.1007/s44206-023-00085-9,Article
"Integrating metaheuristics and artificial intelligence for healthcare: basics, challenging and future directions",Artificial Intelligence Review,,,,10.1007/s10462-024-10822-2,Essam H. HousseinEman SaberAbdelmgeid A. AliYaser M. Wazery,2024,https://link.springer.com/article/10.1007/s10462-024-10822-2,Article
The determinants of reliable smart grid from experts’ perspective,Energy Informatics,,,,10.1186/s42162-023-00266-3,Ibrahim MashalOsama A. KhashanMohammad HijjawiMohammad Alshinwan,2023,https://link.springer.com/article/10.1186/s42162-023-00266-3,Article
"Robots still outnumber humans in web archives in 2019, but less than in 2015 and 2012",International Journal on Digital Libraries,,,,10.1007/s00799-024-00397-2,Himarsha R. JayanettiKritika GargSawood AlamMichael L. NelsonMichele C. Weigle,2024,https://link.springer.com/article/10.1007/s00799-024-00397-2,Article
Ensemble and continual federated learning for classification tasks,Machine Learning,,,,10.1007/s10994-023-06330-z,Fernando E. CasadoDylan LemaRoberto IglesiasCarlos V. RegueiroSenén Barro,2023,https://link.springer.com/article/10.1007/s10994-023-06330-z,Article
A comprehensive review of machine learning techniques on diabetes detection,"Visual Computing for Industry, Biomedicine, and Art",,,,10.1186/s42492-021-00097-7,Toshita SharmaManan Shah,2021,https://link.springer.com/article/10.1186/s42492-021-00097-7,Article
Development of cybersecurity framework for FinTech innovations: Bahrain as a&#xa0;case study,International Cybersecurity Law Review,,,,10.1365/s43439-024-00130-4,Salah AlBenJasimHaifa TakruriRabab Al-ZaidiTooska Dargahi,2024,https://link.springer.com/article/10.1365/s43439-024-00130-4,Article
Revolutionizing personalized medicine with generative AI: a systematic review,Artificial Intelligence Review,,,,10.1007/s10462-024-10768-5,Isaias GhebrehiwetNazar ZakiRafat DamsehMohd Saberi Mohamad,2024,https://link.springer.com/article/10.1007/s10462-024-10768-5,Article
Evaluation of home detection algorithms on mobile phone data using individual-level ground truth,EPJ Data Science,,,,10.1140/epjds/s13688-021-00284-9,Luca PappalardoLeo FerresManuel SacasaCiro CattutoLoreto Bravo,2021,https://link.springer.com/article/10.1140/epjds/s13688-021-00284-9,Article
Autoencoders and their applications in machine learning: a survey,Artificial Intelligence Review,,,,10.1007/s10462-023-10662-6,Kamal BerahmandFatemeh DaneshfarElaheh Sadat SalehiYuefeng LiYue Xu,2024,https://link.springer.com/article/10.1007/s10462-023-10662-6,Article
An Outlook into the Future of Egocentric Vision,International Journal of Computer Vision,,,,10.1007/s11263-024-02095-7,Chiara PlizzariGabriele GolettoAntonino FurnariSiddhant BansalFrancesco RagusaGiovanni Maria FarinellaDima DamenTatiana Tommasi,2024,https://link.springer.com/article/10.1007/s11263-024-02095-7,Article
A Distributed Framework for&#xa0;Remote Multimodal Biosignal Acquisition and&#xa0;Analysis,Digital Health and Wireless Solutions,,,,10.1007/978-3-031-59091-7_9,Constantino Álvarez CasadoPauli RäsänenLe Ngu NguyenArttu LämsäJohannes PeltolaMiguel Bordallo López,2024,https://link.springer.com/chapter/10.1007/978-3-031-59091-7_9,Conference paper
A Deep Learning-Based Hybrid CNN-LSTM Model for Location-Aware Web Service Recommendation,Neural Processing Letters,,,,10.1007/s11063-024-11687-w,Ankur PandeyPraveen Kumar MannepalliManish GuptaRamraj DangiGaurav Choudhary,2024,https://link.springer.com/article/10.1007/s11063-024-11687-w,Article
Artificial intelligence and multimodal data fusion for smart healthcare: topic modeling and bibliometrics,Artificial Intelligence Review,,,,10.1007/s10462-024-10712-7,Xieling ChenHaoran XieXiaohui TaoFu Lee WangMingming LengBaiying Lei,2024,https://link.springer.com/article/10.1007/s10462-024-10712-7,Article
Cashing out crypto: state of practice in ransom payments,International Journal of Information Security,,,,10.1007/s10207-023-00766-z,Constantinos PatsakisEugenia PolitouEfthimios AlepisJulio Hernandez-Castro,2023,https://link.springer.com/article/10.1007/s10207-023-00766-z,Article
Detection of extreme sentiments on social networks with BERT,Social Network Analysis and Mining,,,,10.1007/s13278-022-00882-z,M. Luqman JamilSebastião PaisJoão CordeiroGaël Dias,2022,https://link.springer.com/article/10.1007/s13278-022-00882-z,Article
The news framing of artificial intelligence: a critical exploration of how media discourses make sense of automation,AI & SOCIETY,,,,10.1007/s00146-022-01511-1,Dennis NguyenErik Hekman,2022,https://link.springer.com/article/10.1007/s00146-022-01511-1,Article
"The smart home, a true home? How new technologies disrupt the experience of home for older persons",Universal Access in the Information Society,,,,10.1007/s10209-024-01114-1,Nadine Andrea FelberHamed AlaviElena MugelliniTenzin Wangmo,2024,https://link.springer.com/article/10.1007/s10209-024-01114-1,Article
Multi-class vulnerability prediction using value flow and graph neural networks,Neural Computing and Applications,,,,10.1007/s00521-024-09819-3,Connor McLaughlinYi Lu,2024,https://link.springer.com/article/10.1007/s00521-024-09819-3,Article
"A critical review of intrusion detection systems in the internet of things: techniques, deployment strategy, validation strategy, attacks, public datasets and challenges",Cybersecurity,,,,10.1186/s42400-021-00077-7,Ansam KhraisatAmmar Alazab,2021,https://link.springer.com/article/10.1186/s42400-021-00077-7,Article
"Design, development and performance analysis of cognitive assisting aid with multi sensor fused navigation for visually impaired people",Journal of Big Data,,,,10.1186/s40537-023-00689-5,Myneni Madhu BalaD. N. VasundharaAkkineni HarithaCH. V. K. N. S. N. Moorthy,2023,https://link.springer.com/article/10.1186/s40537-023-00689-5,Article
"Going beyond the “common suspects”: to be presumed innocent in the era of algorithms, big data and artificial intelligence",Artificial Intelligence and Law,,,,10.1007/s10506-023-09347-w,Athina Sachoulidou,2023,https://link.springer.com/article/10.1007/s10506-023-09347-w,Article
AI Guidelines and Ethical Readiness Inside SMEs: A Review and Recommendations,Digital Society,,,,10.1007/s44206-024-00087-1,Marwa Samih SoudiMerja Bauters,2024,https://link.springer.com/article/10.1007/s44206-024-00087-1,Article
From human-centered to symbiotic artificial intelligence: a focus on medical applications,Multimedia Tools and Applications,,,,10.1007/s11042-024-20414-5,Giuseppe DesoldaAndrea EspositoRosa LanzilottiAntonio PiccinnoMaria F. Costabile,2024,https://link.springer.com/article/10.1007/s11042-024-20414-5,Article
Zero shot plant disease classification with semantic attributes,Artificial Intelligence Review,,,,10.1007/s10462-024-10950-9,Pranav KumarJimson MathewRakesh Kumar SanodiyaThanush SettyBhanu Prakash Bhaskarla,2024,https://link.springer.com/article/10.1007/s10462-024-10950-9,Article
How AI hype impacts the LGBTQ + community,AI and Ethics,,,,10.1007/s43681-024-00423-8,Dawn McAra-Hunter,2024,https://link.springer.com/article/10.1007/s43681-024-00423-8,Article
Is iterative feature selection technique efficient enough? A comparative performance analysis of RFECV feature selection technique in ransomware classification using SHAP,Discover Internet of Things,,,,10.1007/s43926-023-00053-2,Rawshan Ara MowriMadhuri SiddulaKaushik Roy,2023,https://link.springer.com/article/10.1007/s43926-023-00053-2,Article
A deep dive into enhancing sharing of naturalistic driving data through face deidentification,The Visual Computer,,,,10.1007/s00371-024-03552-7,Surendrabikram ThapaAbhijit Sarkar,2024,https://link.springer.com/article/10.1007/s00371-024-03552-7,Article
Efficient and scalable patients clustering based on medical big data in cloud platform,Journal of Cloud Computing,,,,10.1186/s13677-022-00324-3,Yongsheng ZhouMajid Ghani Varzaneh,2022,https://link.springer.com/article/10.1186/s13677-022-00324-3,Article
Explainable artificial intelligence (XAI) in finance: a systematic literature review,Artificial Intelligence Review,,,,10.1007/s10462-024-10854-8,Jurgita ČernevičienėAudrius Kabašinskas,2024,https://link.springer.com/article/10.1007/s10462-024-10854-8,Article
Mobile computing-enabled health physique evaluation in campus based on amplified hashing,Journal of Cloud Computing,,,,10.1186/s13677-023-00476-w,Yu XieQiyun ZhangKhosro RezaeeYanwei Xu,2023,https://link.springer.com/article/10.1186/s13677-023-00476-w,Article
AI for the public. How public interest theory shifts the discourse on AI,AI & SOCIETY,,,,10.1007/s00146-022-01480-5,Theresa ZügerHadi Asghari,2022,https://link.springer.com/article/10.1007/s00146-022-01480-5,Article
A comprehensive assessment of artificial intelligence applications for cancer diagnosis,Artificial Intelligence Review,,,,10.1007/s10462-024-10783-6,Gaurav SinghAnushka KamaljaRohit PatilAshutosh KarwaAkansha TripathiPallavi Chavan,2024,https://link.springer.com/article/10.1007/s10462-024-10783-6,Article
Dynamic data hiding capacity enhancement for the Hybrid Near Maximum Histogram image steganography based on Multi-Pixel-Pair approach,Multimedia Tools and Applications,,,,10.1007/s11042-024-19059-1,Adnan SondasNecla Bandirmali Erturk,2024,https://link.springer.com/article/10.1007/s11042-024-19059-1,Article
Machine learning for intrusion detection in industrial control systems: challenges and lessons from experimental evaluation,Cybersecurity,,,,10.1186/s42400-021-00095-5,Gauthama Raman M. R.Chuadhry Mujeeb AhmedAditya Mathur,2021,https://link.springer.com/article/10.1186/s42400-021-00095-5,Article
Non-technical losses detection in energy consumption focusing on energy recovery and explainability,Machine Learning,,,,10.1007/s10994-021-06051-1,Bernat Coma-PuigJosep Carmona,2021,https://link.springer.com/article/10.1007/s10994-021-06051-1,Article
Biometric systems for identification and verification scenarios using spatial footsteps components,Neural Computing and Applications,,,,10.1007/s00521-023-09390-3,Ayman IskandarMarco AlfonseMohamed RoushdyEl-Sayed M. El-Horbaty,2024,https://link.springer.com/article/10.1007/s00521-023-09390-3,Article
AI in Healthcare and the Public Sector: How to Face the Challenges of High-Risk Applications and What AI Research Can Get Out of It,KI - Künstliche Intelligenz,,,,10.1007/s13218-024-00853-w,Tanya BraunRalf Möller,2024,https://link.springer.com/article/10.1007/s13218-024-00853-w,Article
A general and modular framework for dark web analysis,Cluster Computing,,,,10.1007/s10586-023-04189-2,José Manuel Ruiz RódenasJavier Pastor-GalindoFélix Gómez Mármol,2023,https://link.springer.com/article/10.1007/s10586-023-04189-2,Article
"Opinion mining for national security: techniques, domain applications, challenges and research opportunities",Journal of Big Data,,,,10.1186/s40537-021-00536-5,Noor Afiza Mat RazaliNur Atiqah MalizanNor Asiakin HasbullahMuslihah WookNorulzahrah Mohd ZainuddinKhairul Khalil IshakSuzaimah RamliSazali Sukardi,2021,https://link.springer.com/article/10.1186/s40537-021-00536-5,Article
DeepMal: maliciousness-Preserving adversarial instruction learning against static malware detection,Cybersecurity,,,,10.1186/s42400-021-00079-5,Chun YangJinghui XuShuangshuang LiangYanna WuYu WenBoyang ZhangDan Meng,2021,https://link.springer.com/article/10.1186/s42400-021-00079-5,Article
More or less discrimination? Practical feasibility of fairness auditing of technologies for personnel selection,AI & SOCIETY,,,,10.1007/s00146-023-01726-w,Helena MihaljevićIvana MüllerKatja DillAysel Yollu-TokMaximilian von Grafenstein,2023,https://link.springer.com/article/10.1007/s00146-023-01726-w,Article
Concept drift detection and adaptation for federated and continual learning,Multimedia Tools and Applications,,,,10.1007/s11042-021-11219-x,Fernando E. CasadoDylan LemaMarcos F. CriadoRoberto IglesiasCarlos V. RegueiroSenén Barro,2021,https://link.springer.com/article/10.1007/s11042-021-11219-x,Article
New and emerging forms of data and technologies: literature and bibliometric review,Multimedia Tools and Applications,,,,10.1007/s11042-022-13451-5,Petar RadanlievDavid De Roure,2022,https://link.springer.com/article/10.1007/s11042-022-13451-5,Article
Security assurance cases—state of the art of an emerging approach,Empirical Software Engineering,,,,10.1007/s10664-021-09971-7,Mazen MohamadJan-Philipp SteghöferRiccardo Scandariato,2021,https://link.springer.com/article/10.1007/s10664-021-09971-7,Article
Facial identity protection using deep learning technologies: an application in affective computing,AI and Ethics,,,,10.1007/s43681-022-00215-y,Jimiama M. MaseNatalie LeesakulGrazziela P. FigueredoMercedes Torres Torres,2022,https://link.springer.com/article/10.1007/s43681-022-00215-y,Article
Governance and sustainability of distributed continuum systems: a big data approach,Journal of Big Data,,,,10.1186/s40537-023-00737-0,Praveen Kumar DontaBoris SedlakVictor Casamayor PujolSchahram Dustdar,2023,https://link.springer.com/article/10.1186/s40537-023-00737-0,Article
TVRAVNF: an efficient low-cost TEE-based virtual remote attestation scheme for virtual network functions,Cybersecurity,,,,10.1186/s42400-024-00235-7,Jie YuanRui XuXinghai WeiKeji MiaoDongxiao Liu,2024,https://link.springer.com/article/10.1186/s42400-024-00235-7,Article
Leveraging network representation learning and community detection for analyzing the activity profiles of adolescents,Applied Network Science,,,,10.1007/s41109-022-00461-3,Saket GurukarBethany BoettnerChristopher BrowningCatherine CalderSrinivasan Parthasarathy,2022,https://link.springer.com/article/10.1007/s41109-022-00461-3,Article
An architectural framework of elderly healthcare monitoring and tracking through wearable sensor technologies,Multimedia Tools and Applications,,,,10.1007/s11042-024-18177-0,Abeer AlsadoonGhazi Al-NaymatOday D. Jerew,2024,https://link.springer.com/article/10.1007/s11042-024-18177-0,Article
"Assessing the current landscape of AI and sustainability literature: identifying key trends, addressing gaps and challenges",Journal of Big Data,,,,10.1186/s40537-024-00912-x,Shailesh TripathiNadine BachmannManuel BrunnerZiad RizkHerbert Jodlbauer,2024,https://link.springer.com/article/10.1186/s40537-024-00912-x,Article
Deep learning adversarial attacks and defenses in autonomous vehicles: a systematic literature review from a safety perspective,Artificial Intelligence Review,,,,10.1007/s10462-024-11014-8,Ahmed Dawod Mohammed IbrahumManzoor HussainJang-Eui Hong,2024,https://link.springer.com/article/10.1007/s10462-024-11014-8,Article
"Orchestration in the Cloud-to-Things compute continuum: taxonomy, survey and future directions",Journal of Cloud Computing,,,,10.1186/s13677-023-00516-5,Amjad UllahTamas KissJózsef KovácsFrancesco TusaJames DeslauriersHuseyin DagdevirenResmi ArjunHamed Hamzeh,2023,https://link.springer.com/article/10.1186/s13677-023-00516-5,Article
"Cyber insurance: state of the art, trends and future directions",International Journal of Information Security,,,,10.1007/s10207-023-00660-8,Aggeliki TsohouVasiliki DiamantopoulouStefanos GritzalisCostas Lambrinoudakis,2023,https://link.springer.com/article/10.1007/s10207-023-00660-8,Article
A perspective on human activity recognition from inertial motion data,Neural Computing and Applications,,,,10.1007/s00521-023-08863-9,Walid GomaaMohamed A. Khamis,2023,https://link.springer.com/article/10.1007/s00521-023-08863-9,Article
"Biometric technology in “no-gate border crossing solutions” under consideration of privacy, ethical, regulatory and social acceptance",Multimedia Tools and Applications,,,,10.1007/s11042-020-10266-0,Susanne BinderAndrea IannoneChad Leibner,2020,https://link.springer.com/article/10.1007/s11042-020-10266-0,Article
Addressing modern and practical challenges in machine learning: a survey of online federated and transfer learning,Applied Intelligence,,,,10.1007/s10489-022-04065-3,Shuang DaiFanlin Meng,2022,https://link.springer.com/article/10.1007/s10489-022-04065-3,Article
Tracing the evolution of cyber resilience: a historical and conceptual review,International Journal of Information Security,,,,10.1007/s10207-023-00811-x,Vasiliki TzavaraSavvas Vassiliadis,2024,https://link.springer.com/article/10.1007/s10207-023-00811-x,Article
Optimized recurrent neural network-based early diagnosis of crop pest and diseases in agriculture,Discover Computing,,,,10.1007/s10791-024-09481-2,Vijesh Kumar PatelKumar AbhishekShitharth Selvarajan,2024,https://link.springer.com/article/10.1007/s10791-024-09481-2,Article
Cybersecurity vulnerabilities and solutions in Ethiopian university websites,Journal of Big Data,,,,10.1186/s40537-024-00980-z,Ali Yimam EshetuEndris Abdu MohammedAyodeji Olalekan Salau,2024,https://link.springer.com/article/10.1186/s40537-024-00980-z,Article
When large language models meet personalization: perspectives of challenges and opportunities,World Wide Web,,,,10.1007/s11280-024-01276-1,Jin ChenZheng LiuXu HuangChenwang WuQi LiuGangwei JiangYuanhao PuYuxuan LeiXiaolong ChenXingmei WangKai ZhengDefu LianEnhong Chen,2024,https://link.springer.com/article/10.1007/s11280-024-01276-1,Article
Security analysis of permission re-delegation vulnerabilities in Android apps,Empirical Software Engineering,,,,10.1007/s10664-020-09879-8,Biniam Fisseha DemissieMariano CeccatoLwin Khin Shar,2020,https://link.springer.com/article/10.1007/s10664-020-09879-8,Article
Explainable generalized additive neural networks with independent neural network training,Statistics and Computing,,,,10.1007/s11222-023-10320-5,Ines Ortega-FernandezMarta SesteloNora M. Villanueva,2023,https://link.springer.com/article/10.1007/s11222-023-10320-5,Article
Exploring key stakeholders’ perspectives on integrating the EU AI Act with the MDR for certifying AI medical devices,AI and Ethics,,,,10.1007/s43681-024-00612-5,Edmund BalogunDion DcostaAuxane BochChristoph Luetge,2024,https://link.springer.com/article/10.1007/s43681-024-00612-5,Article
In-depth analysis and open challenges of Mist Computing,Journal of Cloud Computing,,,,10.1186/s13677-022-00354-x,Juan José López EscobarRebeca P. Díaz RedondoFelipe Gil-Castiñeira,2022,https://link.springer.com/article/10.1186/s13677-022-00354-x,Article
MobilityDL: a review of deep learning from trajectory data,GeoInformatica,,,,10.1007/s10707-024-00518-8,Anita GraserAnahid JalaliJasmin LampertAxel WeißenfeldKrzysztof Janowicz,2024,https://link.springer.com/article/10.1007/s10707-024-00518-8,Article
