Item Title,Publication Title,Book Series Title,Journal Volume,Journal Issue,Item DOI,Authors,Publication Year,URL,Content Type
Towards a framework for certification of reliable autonomous systems,Autonomous Agents and Multi-Agent Systems,,,,10.1007/s10458-020-09487-2,Michael FisherViviana MascardiKristin Yvonne RozierBernd-Holger SchlingloffMichael WinikoffNeil Yorke-Smith,2020,https://link.springer.com/article/10.1007/s10458-020-09487-2,Article
Study of Middleware for Internet of Healthcare Things and Their Applications,The Impact of Digital Technologies on Public Health in Developed and Developing Countries,,,,10.1007/978-3-030-51517-1_18,Ghofrane Fersi,2020,https://link.springer.com/chapter/10.1007/978-3-030-51517-1_18,Conference paper
Modelling the propagation of properties across services in cyber-physical energy systems,Energy Informatics,,,,10.1186/s42162-024-00320-8,Anand NarayanMichael BrandNils HuxollBatoul Hage HassanSebastian Lehnhoff,2024,https://link.springer.com/article/10.1186/s42162-024-00320-8,Article
Research and Practice of TCP Protocol Optimization in Mobile Internet,Cyber Security,,,,10.1007/978-981-19-8285-9_14,Shizhan LanLifang MaJing Huang,2022,https://link.springer.com/chapter/10.1007/978-981-19-8285-9_14,Conference paper
Robustness of&#xa0;Image-Based Malware Analysis,Silicon Valley Cybersecurity Conference,,,,10.1007/978-3-031-24049-2_1,Katrina TranFabio Di TroiaMark Stamp,2022,https://link.springer.com/chapter/10.1007/978-3-031-24049-2_1,Conference paper
"Comparative Analysis of Gait Speed Estimation Using Wideband and Narrowband Radars, Thermal Camera, and Motion Tracking Suit Technologies",Journal of Healthcare Informatics Research,,,,10.1007/s41666-020-00071-7,P. P. MoritaA. S. RochaG. ShakerD. LeeJ. WeiB. FongA. ThatteA. KarimiL. XuA. MaA. WongJ. Boger,2020,https://link.springer.com/article/10.1007/s41666-020-00071-7,Article
Intelligent and Resource-Conserving Service Function Chain (SFC) Embedding,Journal of Network and Systems Management,,,,10.1007/s10922-023-09771-y,Panteleimon RodisPanagiotis Papadimitriou,2023,https://link.springer.com/article/10.1007/s10922-023-09771-y,Article
Shapley values for cluster importance,Data Mining and Knowledge Discovery,,,,10.1007/s10618-022-00896-3,Andreas BrandsæterIngrid K. Glad,2022,https://link.springer.com/article/10.1007/s10618-022-00896-3,Article
"The shocklet transform: a decomposition method for the identification of local, mechanism-driven dynamics in sociotechnical time series",EPJ Data Science,,,,10.1140/epjds/s13688-020-0220-x,David Rushing DewhurstThayer AlshaabiDilan KileyMichael V. ArnoldJoshua R. MinotChristopher M. DanforthPeter Sheridan Dodds,2020,https://link.springer.com/article/10.1140/epjds/s13688-020-0220-x,Article
Online polarization and cross-fertilization in multi-cleavage societies: the case of Spain,Social Network Analysis and Mining,,,,10.1007/s13278-022-00909-5,Rubén Rodríguez CasañEnrique García-VidalDidier GrimaldiCarlos Carrasco-FarréFrancisco Vaquer-EstalrichJoan Vila-Francés,2022,https://link.springer.com/article/10.1007/s13278-022-00909-5,Article
Factoring ethics in management algorithms for municipal information-analytical systems,AI and Ethics,,,,10.1007/s43681-021-00098-5,Kamolov SergeiKriebitz AlexanderEliseeva PolinaAleksandrov Nikita,2021,https://link.springer.com/article/10.1007/s43681-021-00098-5,Article
Toward Kinecting cognition by behaviour recognition-based deep learning and big data,Universal Access in the Information Society,,,,10.1007/s10209-020-00744-5,Majeed SoufianSamia Nefti-MezianJonathan Drake,2020,https://link.springer.com/article/10.1007/s10209-020-00744-5,Article
Bounded Model Checking for Hyperproperties,Tools and Algorithms for the Construction and Analysis of Systems,,,,10.1007/978-3-030-72016-2_6,Tzu-Han HsuCésar SánchezBorzoo Bonakdarpour,2021,https://link.springer.com/chapter/10.1007/978-3-030-72016-2_6,Conference paper
Big healthcare data: preserving security and privacy,Journal of Big Data,,,,10.1186/s40537-017-0110-7,Karim AbouelmehdiAbderrahim Beni-HessaneHayat Khaloufi,2018,https://link.springer.com/article/10.1186/s40537-017-0110-7,Article
Intent-driven cloud resource design framework to meet cloud performance requirements and its application to a cloud-sensor system,Journal of Cloud Computing,,,,10.1186/s13677-021-00242-w,Chao WuShingo HoriuchiKenji MuraseHiroaki KikushimaKenichi Tayama,2021,https://link.springer.com/article/10.1186/s13677-021-00242-w,Article
Intelligent video surveillance: a review through deep learning techniques for crowd analysis,Journal of Big Data,,,,10.1186/s40537-019-0212-5,G. SreenuM. A. Saleem Durai,2019,https://link.springer.com/article/10.1186/s40537-019-0212-5,Article
A user-guided personalization methodology to facilitate new smart home occupancy,Universal Access in the Information Society,,,,10.1007/s10209-022-00883-x,S. M. Murad AliJuan Carlos AugustoDavid WindridgeEmma Ward,2022,https://link.springer.com/article/10.1007/s10209-022-00883-x,Article
Towards effective assessment of steady state performance in Java software: are we there yet?,Empirical Software Engineering,,,,10.1007/s10664-022-10247-x,Luca TrainiVittorio CortellessaDaniele Di PompeoMichele Tucci,2022,https://link.springer.com/article/10.1007/s10664-022-10247-x,Article
SaS-BCI: a new strategy to predict image memorability and use mental imagery as a brain-based biometric authentication,Neural Computing and Applications,,,,10.1007/s00521-020-05247-1,Fares YousefiHoshang KolivandThar Baker,2020,https://link.springer.com/article/10.1007/s00521-020-05247-1,Article
"The AI Methods, Capabilities and Criticality Grid",KI - Künstliche Intelligenz,,,,10.1007/s13218-021-00736-4,Thomas SchmidWolfgang HildesheimTaras HoloyadKinga Schumacher,2021,https://link.springer.com/article/10.1007/s13218-021-00736-4,Article
Pretty Good Strategies for Benaloh Challenge,Electronic Voting,,,,10.1007/978-3-031-43756-4_7,Wojciech Jamroga,2023,https://link.springer.com/chapter/10.1007/978-3-031-43756-4_7,Conference paper
Measuring objective and subjective well-being: dimensions and data sources,International Journal of Data Science and Analytics,,,,10.1007/s41060-020-00224-2,Vasiliki VoukelatouLorenzo GabrielliIoanna MiliouStefano CresciRajesh SharmaMaurizio TesconiLuca Pappalardo,2020,https://link.springer.com/article/10.1007/s41060-020-00224-2,Article
A survey on feature extraction and learning techniques for link prediction in homogeneous and heterogeneous complex networks,Artificial Intelligence Review,,,,10.1007/s10462-024-10998-7,Puneet KapoorSakshi KaushalHarish KumarKushal Kanwar,2024,https://link.springer.com/article/10.1007/s10462-024-10998-7,Article
Big Data fraud detection using multiple medicare data sources,Journal of Big Data,,,,10.1186/s40537-018-0138-3,Matthew HerlandTaghi M. KhoshgoftaarRichard A. Bauder,2018,https://link.springer.com/article/10.1186/s40537-018-0138-3,Article
COVID-19 and 5G conspiracy theories: long term observation of a digital wildfire,International Journal of Data Science and Analytics,,,,10.1007/s41060-022-00322-3,Johannes LangguthPetra FilkukováStefan BrennerDaniel Thilo SchroederKonstantin Pogorelov,2022,https://link.springer.com/article/10.1007/s41060-022-00322-3,Article
Decision-making under uncertainty: beyond probabilities,International Journal on Software Tools for Technology Transfer,,,,10.1007/s10009-023-00704-3,Thom BadingsThiago D. SimãoMarnix SuilenNils Jansen,2023,https://link.springer.com/article/10.1007/s10009-023-00704-3,Article
The minimum description length principle for pattern mining: a survey,Data Mining and Knowledge Discovery,,,,10.1007/s10618-022-00846-z,Esther Galbrun,2022,https://link.springer.com/article/10.1007/s10618-022-00846-z,Article
Recommender systems in the healthcare domain: state-of-the-art and research issues,Journal of Intelligent Information Systems,,,,10.1007/s10844-020-00633-6,Thi Ngoc Trang TranAlexander FelfernigChristoph TrattnerAndreas Holzinger,2020,https://link.springer.com/article/10.1007/s10844-020-00633-6,Article
Daily Routine Recognition for Hearing Aid Personalization,SN Computer Science,,,,10.1007/s42979-021-00538-3,Thomas KuebertHenning PuderHeinz Koeppl,2021,https://link.springer.com/article/10.1007/s42979-021-00538-3,Article
Towards an effective transnational regulation of AI,AI & SOCIETY,,,,10.1007/s00146-021-01310-0,Daniel J. Gervais,2021,https://link.springer.com/article/10.1007/s00146-021-01310-0,Article
Anomaly behaviour detection based on the meta-Morisita index for large scale spatio-temporal data set,Journal of Big Data,,,,10.1186/s40537-018-0133-8,Zhao YangNathalie Japkowicz,2018,https://link.springer.com/article/10.1186/s40537-018-0133-8,Article
Multi-sensor fusion based on multiple classifier systems for human activity identification,Human-centric Computing and Information Sciences,,,,10.1186/s13673-019-0194-5,Henry Friday NwekeYing Wah TehGhulam MujtabaUzoma Rita AloMohammed Ali Al-garadi,2019,https://link.springer.com/article/10.1186/s13673-019-0194-5,Article
Feature selection for driving fatigue characterization and detection using visual- and signal-based sensors,Applied Informatics,,,,10.1186/s40535-018-0054-9,Khadidja HenniNeila MezghaniCharles Gouin-VallerandPerrine RuerYoussef OuakrimÉvelyne Vallières,2018,https://link.springer.com/article/10.1186/s40535-018-0054-9,Article
Robust cooperative car-parking: implications and solutions for selfish inter-vehicular social behaviour,Human-centric Computing and Information Sciences,,,,10.1186/s13673-020-00243-9,Ali AliedaniSeng W. LokeSebastien Glaser,2020,https://link.springer.com/article/10.1186/s13673-020-00243-9,Article
Structural inequalities emerging from a large wire transfers network,Applied Network Science,,,,10.1007/s41109-020-00314-x,Alfonso SemeraroMarcella TambuscioSilvia RonchiadinLaura Li PumaGiancarlo Ruffo,2020,https://link.springer.com/article/10.1007/s41109-020-00314-x,Article
Autonomous learning for fuzzy systems: a review,Artificial Intelligence Review,,,,10.1007/s10462-022-10355-6,Xiaowei GuJungong HanQiang ShenPlamen P. Angelov,2022,https://link.springer.com/article/10.1007/s10462-022-10355-6,Article
Adaptive user interfaces in systems targeting chronic disease: a systematic literature review,User Modeling and User-Adapted Interaction,,,,10.1007/s11257-023-09384-9,Wei WangHourieh KhalajzadehJohn GrundyAnuradha MadugallaJennifer McIntoshHumphrey O. Obie,2023,https://link.springer.com/article/10.1007/s11257-023-09384-9,Article
Spatio-temporal analysis and comparison of 3D videos,The Visual Computer,,,,10.1007/s00371-022-02409-1,Simone CammarasanaGiuseppe Patanè,2022,https://link.springer.com/article/10.1007/s00371-022-02409-1,Article
Predicting students at risk of academic failure using ensemble model during pandemic in a distance learning system,International Journal of Educational Technology in Higher Education,,,,10.1186/s41239-021-00300-y,Halit KaralarCeyhun KapucuHüseyin Gürüler,2021,https://link.springer.com/article/10.1186/s41239-021-00300-y,Article
Robots beyond Science Fiction: mutual learning in human–robot interaction on the way to participatory approaches,AI & SOCIETY,,,,10.1007/s00146-021-01209-w,Astrid WeissKatta Spiel,2021,https://link.springer.com/article/10.1007/s00146-021-01209-w,Article
Generalised Differential Privacy for Text Document Processing,Principles of Security and Trust,,,,10.1007/978-3-030-17138-4_6,Natasha FernandesMark DrasAnnabelle McIver,2019,https://link.springer.com/chapter/10.1007/978-3-030-17138-4_6,Conference paper
An analysis of the graph processing landscape,Journal of Big Data,,,,10.1186/s40537-021-00443-9,Miguel E. CoimbraAlexandre P. FranciscoLuís Veiga,2021,https://link.springer.com/article/10.1186/s40537-021-00443-9,Article
Augmented reality in architecture and construction education: state of the field and opportunities,International Journal of Educational Technology in Higher Education,,,,10.1186/s41239-022-00343-9,Aso HajirasouliSaeed Banihashemi,2022,https://link.springer.com/article/10.1186/s41239-022-00343-9,Article
On the scalability of the speedup considering the overhead of consolidating virtual machines in servers for data centers,The Journal of Supercomputing,,,,10.1007/s11227-024-05943-y,Carlos JuizBelen Bermejo,2024,https://link.springer.com/article/10.1007/s11227-024-05943-y,Article
Exploring critical factors of the perceived usefulness of a learning analytics dashboard for distance university students,International Journal of Educational Technology in Higher Education,,,,10.1186/s41239-021-00284-9,Irina RetsChristothea HerodotouVaclav BayerMartin HlostaBart Rienties,2021,https://link.springer.com/article/10.1186/s41239-021-00284-9,Article
"Environmentally data-driven smart sustainable cities: applied innovative solutions for energy efficiency, pollution reduction, and urban metabolism",Energy Informatics,,,,10.1186/s42162-020-00130-8,Simon Elias BibriJohn Krogstie,2020,https://link.springer.com/article/10.1186/s42162-020-00130-8,Article
An empirical investigation of command-line customization,Empirical Software Engineering,,,,10.1007/s10664-021-10036-y,Michael SchröderJürgen Cito,2021,https://link.springer.com/article/10.1007/s10664-021-10036-y,Article
Artificial intelligence in the creative industries: a review,Artificial Intelligence Review,,,,10.1007/s10462-021-10039-7,Nantheera AnantrasirichaiDavid Bull,2021,https://link.springer.com/article/10.1007/s10462-021-10039-7,Article
Joint 3D facial shape reconstruction and texture completion from a single image,Computational Visual Media,,,,10.1007/s41095-021-0238-4,Xiaoxing ZengZhelun WuXiaojiang PengYu Qiao,2021,https://link.springer.com/article/10.1007/s41095-021-0238-4,Article
Elite and dynamic opposite learning enhanced sine cosine algorithm for application to plat-fin heat exchangers design problem,Neural Computing and Applications,,,,10.1007/s00521-021-05963-2,Lidong ZhangTianyu HuZhile YangDongsheng YangJianhua Zhang,2021,https://link.springer.com/article/10.1007/s00521-021-05963-2,Article
The practical ethics of bias reduction in machine translation: why domain adaptation is better than data debiasing,Ethics and Information Technology,,,,10.1007/s10676-021-09583-1,Marcus TomalinBill ByrneShauna ConcannonDanielle SaundersStefanie Ullmann,2021,https://link.springer.com/article/10.1007/s10676-021-09583-1,Article
The emerging data–driven Smart City and its innovative applied solutions for sustainability: the cases of London and Barcelona&#xa0;,Energy Informatics,,,,10.1186/s42162-020-00108-6,Simon Elias BibriJohn Krogstie,2020,https://link.springer.com/article/10.1186/s42162-020-00108-6,Article
A hybrid framework combining background subtraction and deep neural networks for rapid person detection,Journal of Big Data,,,,10.1186/s40537-018-0131-x,Chulyeon KimJiyoung LeeTaekjin HanYoung-Min Kim,2018,https://link.springer.com/article/10.1186/s40537-018-0131-x,Article
Recommender systems in model-driven engineering,Software and Systems Modeling,,,,10.1007/s10270-021-00905-x,Lissette AlmonteEsther GuerraIván CantadorJuan de Lara,2021,https://link.springer.com/article/10.1007/s10270-021-00905-x,Article
Paracosm: A Test Framework for Autonomous Driving Simulations,Fundamental Approaches to Software Engineering,,,,10.1007/978-3-030-71500-7_9,Rupak MajumdarAman MathurMarcus PirronLaura StegnerDamien Zufferey,2021,https://link.springer.com/chapter/10.1007/978-3-030-71500-7_9,Conference paper
Towards Content Sensitivity Analysis,Advances in Intelligent Data Analysis XVIII,,,,10.1007/978-3-030-44584-3_6,Elena BattagliaLivio BioglioRuggero G. Pensa,2020,https://link.springer.com/chapter/10.1007/978-3-030-44584-3_6,Conference paper
State description of cyber-physical energy systems,Energy Informatics,,,,10.1186/s42162-020-00119-3,Marcel KlaesAnand NarayanAmit Dilip PatilJonas HaackMartin LindnerChristian RehtanzMartin BraunSebastian LehnhoffHermann de Meer,2020,https://link.springer.com/article/10.1186/s42162-020-00119-3,Article
An efficient population-based multi-objective task scheduling approach in fog computing systems,Journal of Cloud Computing,,,,10.1186/s13677-021-00264-4,Zahra MovahediBruno DefudeAmir mohammad Hosseininia,2021,https://link.springer.com/article/10.1186/s13677-021-00264-4,Article
Modular norm models: practical representation and analysis of contractual rights and obligations,Requirements Engineering,,,,10.1007/s00766-019-00323-y,Sayonnha MandalRobin GandhiHarvey Siy,2019,https://link.springer.com/article/10.1007/s00766-019-00323-y,Article
Measuring and visualizing cyber threat intelligence quality,International Journal of Information Security,,,,10.1007/s10207-020-00490-y,Daniel SchletteFabian BöhmMarco CaselliGünther Pernul,2020,https://link.springer.com/article/10.1007/s10207-020-00490-y,Article
An extensive analysis of the presence of altmetric data for Web of Science publications across subject fields and research topics,Scientometrics,,,,10.1007/s11192-020-03564-9,Zhichao FangRodrigo CostasWencan TianXianwen WangPaul Wouters,2020,https://link.springer.com/article/10.1007/s11192-020-03564-9,Article
Testing machine learning based systems: a systematic mapping,Empirical Software Engineering,,,,10.1007/s10664-020-09881-0,Vincenzo RiccioGunel JahangirovaAndrea StoccoNargiz HumbatovaMichael WeissPaolo Tonella,2020,https://link.springer.com/article/10.1007/s10664-020-09881-0,Article
An experimental scrutiny of visual design modelling: VCL up against UML+OCL,Empirical Software Engineering,,,,10.1007/s10664-019-09784-9,Nuno AmálioLionel BriandPierre Kelsen,2019,https://link.springer.com/article/10.1007/s10664-019-09784-9,Article
"Harnessing social media data for pharmacovigilance: a review of current state of the art, challenges and future directions",International Journal of Data Science and Analytics,,,,10.1007/s41060-019-00175-3,Dimitra PappaLampros K. Stergioulas,2019,https://link.springer.com/article/10.1007/s41060-019-00175-3,Article
Increasing sensor reliability through confidence attribution,Journal of the Brazilian Computer Society,,,,10.1186/s13173-019-0094-6,Roberto M. ScheffelAntônio A. Fröhlich,2019,https://link.springer.com/article/10.1186/s13173-019-0094-6,Article
Enhancing COVID-19 tracking apps with human activity recognition using a deep convolutional neural network and HAR-images,Neural Computing and Applications,,,,10.1007/s00521-021-05913-y,Gianni D’AngeloFrancesco Palmieri,2021,https://link.springer.com/article/10.1007/s00521-021-05913-y,Article
A survey on data‐efficient algorithms in big data era,Journal of Big Data,,,,10.1186/s40537-021-00419-9,Amina Adadi,2021,https://link.springer.com/article/10.1186/s40537-021-00419-9,Article
Ontologies for finding journalistic angles,Software and Systems Modeling,,,,10.1007/s10270-020-00801-w,Andreas L. OpdahlBjørnar Tessem,2020,https://link.springer.com/article/10.1007/s10270-020-00801-w,Article
Image Matching from Handcrafted to Deep Features: A Survey,International Journal of Computer Vision,,,,10.1007/s11263-020-01359-2,Jiayi MaXingyu JiangAoxiang FanJunjun JiangJunchi Yan,2020,https://link.springer.com/article/10.1007/s11263-020-01359-2,Article
SonarSnoop: active acoustic side-channel attacks,International Journal of Information Security,,,,10.1007/s10207-019-00449-8,Peng ChengIbrahim Ethem BagciUtz RoedigJeff Yan,2019,https://link.springer.com/article/10.1007/s10207-019-00449-8,Article
Application of NOMA for cellular-connected UAVs: opportunities and challenges,Science China Information Sciences,,,,10.1007/s11432-020-2986-8,Wee Kiat NewChee Yen LeowKeivan NavaieYanshi SunZhiguo Ding,2021,https://link.springer.com/article/10.1007/s11432-020-2986-8,Article
"Automated machine learning: past, present and future",Artificial Intelligence Review,,,,10.1007/s10462-024-10726-1,Mitra BaratchiCan WangSteffen LimmerJan N. van RijnHolger HoosThomas BäckMarkus Olhofer,2024,https://link.springer.com/article/10.1007/s10462-024-10726-1,Article
Malware Guard Extension: abusing Intel SGX to conceal cache attacks,Cybersecurity,,,,10.1186/s42400-019-0042-y,Michael SchwarzSamuel WeiserDaniel GrussClémentine MauriceStefan Mangard,2020,https://link.springer.com/article/10.1186/s42400-019-0042-y,Article
Text Data Augmentation for Deep Learning,Journal of Big Data,,,,10.1186/s40537-021-00492-0,Connor ShortenTaghi M. KhoshgoftaarBorko Furht,2021,https://link.springer.com/article/10.1186/s40537-021-00492-0,Article
The SEPSES Knowledge Graph: An Integrated Resource for Cybersecurity,The Semantic Web – ISWC 2019,,,,10.1007/978-3-030-30796-7_13,Elmar KieslingAndreas EkelhartKabul KurniawanFajar Ekaputra,2019,https://link.springer.com/chapter/10.1007/978-3-030-30796-7_13,Conference paper
Fog computing security: a review of current applications and security solutions,Journal of Cloud Computing,,,,10.1186/s13677-017-0090-3,Saad KhanSimon ParkinsonYongrui Qin,2017,https://link.springer.com/article/10.1186/s13677-017-0090-3,Article
Systematic review of research on artificial intelligence applications in higher education – where are the educators?,International Journal of Educational Technology in Higher Education,,,,10.1186/s41239-019-0171-0,Olaf Zawacki-RichterVictoria I. MarínMelissa BondFranziska Gouverneur,2019,https://link.springer.com/article/10.1186/s41239-019-0171-0,Article
Relative Hausdorff distance for network analysis,Applied Network Science,,,,10.1007/s41109-019-0198-0,Sinan G. AksoyKathleen E. NowakEmilie PurvineStephen J. Young,2019,https://link.springer.com/article/10.1007/s41109-019-0198-0,Article
Characterizing industry-academia collaborations in software engineering: evidence from 101 projects,Empirical Software Engineering,,,,10.1007/s10664-019-09711-y,Vahid GarousiDietmar PfahlJoão M. FernandesMichael FeldererMika V. MäntyläDavid ShepherdAndrea ArcuriAhmet CoşkunçayBedir Tekinerdogan,2019,https://link.springer.com/article/10.1007/s10664-019-09711-y,Article
Security threats to critical infrastructure: the human factor,The Journal of Supercomputing,,,,10.1007/s11227-018-2337-2,Ibrahim GhafirJibran SaleemMohammad HammoudehHanan FaourVaclav PrenosilSardar JafSohail JabbarThar Baker,2018,https://link.springer.com/article/10.1007/s11227-018-2337-2,Article
Flexible computation offloading in a fuzzy-based mobile edge orchestrator for IoT applications,Journal of Cloud Computing,,,,10.1186/s13677-020-00211-9,VanDung NguyenTran Trong KhanhTri D. T. NguyenChoong Seon HongEui-Nam Huh,2020,https://link.springer.com/article/10.1186/s13677-020-00211-9,Article
Application of evolutionary and swarm optimization in computer vision: a literature survey,IPSJ Transactions on Computer Vision and Applications,,,,10.1186/s41074-020-00065-9,Takumi NakaneNaranchimeg BoldHaitian SunXuequan LuTakuya AkashiChao Zhang,2020,https://link.springer.com/article/10.1186/s41074-020-00065-9,Article
A Generalized Formal Semantic Framework for Smart Contracts,Fundamental Approaches to Software Engineering,,,,10.1007/978-3-030-45234-6_4,Jiao JiaoShang-Wei LinJun Sun,2020,https://link.springer.com/chapter/10.1007/978-3-030-45234-6_4,Conference paper
A survey on the design space of end-user-oriented languages for specifying robotic missions,Software and Systems Modeling,,,,10.1007/s10270-020-00854-x,Swaib DraguleThorsten BergerClaudio MenghiPatrizio Pelliccione,2021,https://link.springer.com/article/10.1007/s10270-020-00854-x,Article
Energy-aware MAC protocol for data differentiated services in sensor-cloud computing,Journal of Cloud Computing,,,,10.1186/s13677-020-00196-5,Shun LiuGuosheng HuangJinsong GuiTian WangXiong Li,2020,https://link.springer.com/article/10.1186/s13677-020-00196-5,Article
Microdecisions and autonomy in self-driving cars: virtual probabilities,AI & SOCIETY,,,,10.1007/s00146-020-01115-7,Florian Sprenger,2020,https://link.springer.com/article/10.1007/s00146-020-01115-7,Article
Adversarial vulnerability bounds for Gaussian process classification,Machine Learning,,,,10.1007/s10994-022-06224-6,Michael Thomas SmithKathrin GrosseMichael BackesMauricio A. Álvarez,2022,https://link.springer.com/article/10.1007/s10994-022-06224-6,Article
Analysing Time-Stamped Co-Editing Networks in Software Development Teams using git2net,Empirical Software Engineering,,,,10.1007/s10664-020-09928-2,Christoph GoteIngo ScholtesFrank Schweitzer,2021,https://link.springer.com/article/10.1007/s10664-020-09928-2,Article
A traffic analysis attack to compute social network measures,Multimedia Tools and Applications,,,,10.1007/s11042-018-6217-9,Alejandra Guadalupe Silva TrujilloAna Lucila Sandoval OrozcoLuis Javier García VillalbaTai-Hoon Kim,2018,https://link.springer.com/article/10.1007/s11042-018-6217-9,Article
Cooperative co-evolution for feature selection in Big Data with random feature grouping,Journal of Big Data,,,,10.1186/s40537-020-00381-y,A. N. M. Bazlur RashidMohiuddin AhmedLeslie F. SikosPaul Haskell-Dowland,2020,https://link.springer.com/article/10.1186/s40537-020-00381-y,Article
Formal methods in dependable systems engineering: a survey of professionals from Europe and North America,Empirical Software Engineering,,,,10.1007/s10664-020-09836-5,Mario GleirscherDiego Marmsoler,2020,https://link.springer.com/article/10.1007/s10664-020-09836-5,Article
User characteristics that influence judgment of social engineering attacks in social networks,Human-centric Computing and Information Sciences,,,,10.1186/s13673-018-0128-7,Samar Muslah AlbladiGeorge R. S. Weir,2018,https://link.springer.com/article/10.1186/s13673-018-0128-7,Article
Can Machines Read our Minds?,Minds and Machines,,,,10.1007/s11023-019-09497-4,Christopher BurrNello Cristianini,2019,https://link.springer.com/article/10.1007/s11023-019-09497-4,Article
