Item Title,Publication Title,Book Series Title,Journal Volume,Journal Issue,Item DOI,Authors,Publication Year,URL,Content Type
Embedding artificial intelligence in society: looking beyond the EU AI master plan using the culture cycle,AI & SOCIETY,,,,10.1007/s00146-021-01383-x,Simone BorsciVille V. LehtolaFrancesco NexMichael Ying YangEllen-Wien AugustijnLeila BagheriyeChristoph BruneOurania KounadiJamy LiJoao MoreiraJoanne Van Der NagelBernard VeldkampDuc V. LeMingshu WangFons WijnhovenJelmer M. WolterinkRaul Zurita-Milla,2022,https://link.springer.com/article/10.1007/s00146-021-01383-x,Article
Protecting Citizens’ Personal Data and Privacy: Joint Effort from GDPR EU Cluster Research Projects,SN Computer Science,,,,10.1007/s42979-020-00218-8,Renata M. de CarvalhoCamillo Del PreteYod Samuel MartinRosa M. Araujo RiveroMelek ÖnenFrancesco Paolo SchiavoÁngel Cuevas RumínHaralambos MouratidisJuan C. YelmoMaria N. Koukovini,2020,https://link.springer.com/article/10.1007/s42979-020-00218-8,Article
The potential effects of deepfakes on news media and entertainment,AI & SOCIETY,,,,10.1007/s00146-024-02072-1,Ebba LundbergPeter Mozelius,2024,https://link.springer.com/article/10.1007/s00146-024-02072-1,Article
The double-edged sword of AI: Ethical Adversarial Attacks to counter artificial intelligence for crime,AI and Ethics,,,,10.1007/s43681-021-00113-9,Michał ChoraśMichał Woźniak,2021,https://link.springer.com/article/10.1007/s43681-021-00113-9,Article
A Scalable Architecture for&#xa0;Electronic Payments,Financial Cryptography and Data Security. FC 2022 International Workshops,,,,10.1007/978-3-031-32415-4_38,Geoff GoodellD. R. ToliverHazem Danny Nakib,2023,https://link.springer.com/chapter/10.1007/978-3-031-32415-4_38,Conference paper
A TCP-based covert channel with integrity check and retransmission,International Journal of Information Security,,,,10.1007/s10207-024-00879-z,Stefano BistarelliAndrea ImparatoFrancesco Santini,2024,https://link.springer.com/article/10.1007/s10207-024-00879-z,Article
Review of few-shot learning application in CSI human sensing,Artificial Intelligence Review,,,,10.1007/s10462-024-10812-4,Zhengjie WangJianhang LiWenchao WangZhaolei DongQingwei ZhangYinjing Guo,2024,https://link.springer.com/article/10.1007/s10462-024-10812-4,Article
Analysis of MR–VR tele-operation methods for legged-manipulator robots,Virtual Reality,,,,10.1007/s10055-024-01021-z,Christyan Cruz UlloaDavid DomínguezJaime del CerroAntonio Barrientos,2024,https://link.springer.com/article/10.1007/s10055-024-01021-z,Article
"Test smells 20 years later: detectability, validity, and reliability",Empirical Software Engineering,,,,10.1007/s10664-022-10207-5,Annibale PanichellaSebastiano PanichellaGordon FraserAnand Ashok SawantVincent J. Hellendoorn,2022,https://link.springer.com/article/10.1007/s10664-022-10207-5,Article
Augmented testing to support manual GUI-based regression testing: An empirical study,Empirical Software Engineering,,,,10.1007/s10664-024-10522-z,Andreas BauerJulian FrattiniEmil Alégroth,2024,https://link.springer.com/article/10.1007/s10664-024-10522-z,Article
Evaluating classifier performance with highly imbalanced Big Data,Journal of Big Data,,,,10.1186/s40537-023-00724-5,John T. HancockTaghi M. KhoshgoftaarJustin M. Johnson,2023,https://link.springer.com/article/10.1186/s40537-023-00724-5,Article
Identifying “sloppy” users in TMS through operation logs,International Journal of Information Technology,,,,10.1007/s41870-023-01489-z,Shaoyang ZhangLian WenGeraldine TorrisiJicheng Li,2023,https://link.springer.com/article/10.1007/s41870-023-01489-z,Article
Employing machine learning in water infrastructure management: predicting pipeline failures for improved maintenance and sustainable operations,Industrial Artificial Intelligence,,,,10.1007/s44244-024-00022-w,Yasin Asadi,2024,https://link.springer.com/article/10.1007/s44244-024-00022-w,Article
Classification and online clustering of zero-day malware,Journal of Computer Virology and Hacking Techniques,,,,10.1007/s11416-024-00513-5,Olha JurečkováMartin JurečekMark StampFabio Di TroiaRóbert Lórencz,2024,https://link.springer.com/article/10.1007/s11416-024-00513-5,Article
Mapping the complexity of political ideology using emergent networks: the Chilean case,Applied Network Science,,,,10.1007/s41109-022-00459-x,María P. RaveauJuan P. CouyoumdjianClaudio Fuentes-Bravo,2022,https://link.springer.com/article/10.1007/s41109-022-00459-x,Article
Comparing GPS and cell-based mobile phone data to identify activity participation during the COVID-19 pandemic,EPJ Data Science,,,,10.1140/epjds/s13688-024-00510-0,Sebastian A. MuellerSydney PaltraJakob RehmannRicardo EwertKai Nagel,2024,https://link.springer.com/article/10.1140/epjds/s13688-024-00510-0,Article
Identifying the most accurate machine learning classification technique to detect network threats,Neural Computing and Applications,,,,10.1007/s00521-024-09562-9,Mohamed FaroukRasha Hassan SakrNoha Hikal,2024,https://link.springer.com/article/10.1007/s00521-024-09562-9,Article
The effect of choosing optimizer algorithms to improve computer vision tasks: a comparative study,Multimedia Tools and Applications,,,,10.1007/s11042-022-13820-0,Esraa HassanMahmoud Y. ShamsNoha A. HikalSamir Elmougy,2022,https://link.springer.com/article/10.1007/s11042-022-13820-0,Article
A scoping review and a taxonomy of the use of motion-based technology centered on the end user. A special focus on elderly health,Multimedia Tools and Applications,,,,10.1007/s11042-023-15185-4,Benoit BossavitAntonio J. Fernández-Leiva,2023,https://link.springer.com/article/10.1007/s11042-023-15185-4,Article
Malicious uses of blockchains by malware: from the analysis to Smart-Zephyrus,International Journal of Information Security,,,,10.1007/s10207-023-00700-3,Mar Gimenez-AguilarJose Maria de FuentesLorena Gonzalez-Manzano,2023,https://link.springer.com/article/10.1007/s10207-023-00700-3,Article
Analysis on dendritic deep learning model for AMR task,Cybersecurity,,,,10.1186/s42400-024-00306-9,Peng YinSanli ZhuYang YuZiqian WangZhuangzhi Chen,2024,https://link.springer.com/article/10.1186/s42400-024-00306-9,Article
Auditing of AI in Railway Technology – a European Legal Approach,Digital Society,,,,10.1007/s44206-022-00015-1,Dagmar Gesmann-NuisslStephan Kunitz,2022,https://link.springer.com/article/10.1007/s44206-022-00015-1,Article
Device free human activity and fall recognition using WiFi channel state information (CSI),CCF Transactions on Pervasive Computing and Interaction,,,,10.1007/s42486-020-00027-1,Neena DamodaranElis HaruniMuyassar KokhkharovaJörg Schäfer,2020,https://link.springer.com/article/10.1007/s42486-020-00027-1,Article
"Community, solidarity and care through data? An ethical analysis of the interpersonal dimension of self-tracking",AI & SOCIETY,,,,10.1007/s00146-024-02013-y,Michał Wieczorek,2024,https://link.springer.com/article/10.1007/s00146-024-02013-y,Article
Computing Diversity Paradigm for the Utilization of Unused Telephony and Marine Infrastructure,International Journal of Networked and Distributed Computing,,,,10.1007/s44227-024-00027-y,A PeriolaE. Obayiuwana,2024,https://link.springer.com/article/10.1007/s44227-024-00027-y,Article
"The ethics of facial recognition technologies, surveillance, and accountability in an age of artificial intelligence: a comparative analysis of US, EU, and UK regulatory frameworks",AI and Ethics,,,,10.1007/s43681-021-00077-w,Denise AlmeidaKonstantin ShmarkoElizabeth Lomas,2021,https://link.springer.com/article/10.1007/s43681-021-00077-w,Article
Mitigating adversarial evasion attacks by deep active learning for medical image classification,Multimedia Tools and Applications,,,,10.1007/s11042-021-11473-z,Usman AhmedJerry Chun-Wei LinGautam Srivastava,2022,https://link.springer.com/article/10.1007/s11042-021-11473-z,Article
Role of machine learning and deep learning techniques in EEG-based BCI emotion recognition system: a review,Artificial Intelligence Review,,,,10.1007/s10462-023-10690-2,Priyadarsini SamalMohammad Farukh Hashmi,2024,https://link.springer.com/article/10.1007/s10462-023-10690-2,Article
Deploying a robotic positive psychology coach to improve college students’ psychological well-being,User Modeling and User-Adapted Interaction,,,,10.1007/s11257-022-09337-8,Sooyeon JeongLaura Aymerich-FranchKika AriasSharifa AlghowinemAgata LapedrizaRosalind PicardHae Won ParkCynthia Breazeal,2022,https://link.springer.com/article/10.1007/s11257-022-09337-8,Article
A Survey on the Use of Lightweight Virtualization in I4.0 Manufacturing Environments,Journal of Network and Systems Management,,,,10.1007/s10922-023-09725-4,Giuseppe Di ModicaLuca Foschini,2023,https://link.springer.com/article/10.1007/s10922-023-09725-4,Article
Developing a pragmatic evaluation of ICTs for older adults with cognitive impairment at scale: the IN LIFE experience,Universal Access in the Information Society,,,,10.1007/s10209-021-00849-5,A. J. AstellM. PanouK. TouliouY. KaravidopoulouM. F. Cabrera-UmpiérrezE. AldazJ. BizjakB. BlackM. BuchholzJ. Chamorro MataF. Cossu-ErgecerS. DebringM. Dekker van-WeeringA. EkströmM. GamsA. Garcia SolerA. GradišekK. GoljufE. KaimakamisN. KaklanisV. KilintzisK. LaaksoN. MaglaverasJ. B. Montalvá ColomerV. PapageorgiouS. PotterC. SamuelssonS. K. SmithM. Tabak,2021,https://link.springer.com/article/10.1007/s10209-021-00849-5,Article
Information Resilience: the nexus of responsible and agile approaches to information use,The VLDB Journal,,,,10.1007/s00778-021-00720-2,Shazia SadiqAmir AryaniGianluca DemartiniWen HuaMarta IndulskaAndrew Burton-JonesHassan KhosraviDiana Benavides-PradoTimos SellisIda SomehRhema VaithianathanSen WangXiaofang Zhou,2022,https://link.springer.com/article/10.1007/s00778-021-00720-2,Article
Classification of cervical cells from the Pap smear image using the RES_DCGAN data augmentation and ResNet50V2 with self-attention architecture,Neural Computing and Applications,,,,10.1007/s00521-024-10404-x,Betelhem Zewdu WubinehAndrzej RusieckiKrzysztof Halawa,2024,https://link.springer.com/article/10.1007/s00521-024-10404-x,Article
Enhancing Agricultural Productivity: A Machine Learning Approach to Crop Recommendations,Human-Centric Intelligent Systems,,,,10.1007/s44230-024-00081-3,Farida Siddiqi PrityMD. Mehadi HasanShakhawat Hossain SaifMd. Maruf HossainSazzad Hossain BhuiyanMd. Ariful IslamMd Tousif Hasan Lavlu,2024,https://link.springer.com/article/10.1007/s44230-024-00081-3,Article
Exploring explainable AI in the tax domain,Artificial Intelligence and Law,,,,10.1007/s10506-024-09395-w,Łukasz GórskiBłażej KuźniackiMarco AlmadaKamil TylińskiMadalena CalvoPablo Matias AsnaghiLuciano AlmadaHilario IñiguezFernando RubianesOctavio PeraJuan Ignacio Nigrelli,2024,https://link.springer.com/article/10.1007/s10506-024-09395-w,Article
The social and ethical impacts of artificial intelligence in agriculture: mapping the agricultural AI literature,AI & SOCIETY,,,,10.1007/s00146-021-01377-9,Mark Ryan,2022,https://link.springer.com/article/10.1007/s00146-021-01377-9,Article
AutoML in heavily constrained applications,The VLDB Journal,,,,10.1007/s00778-023-00820-1,Felix NeutatzMarius LindauerZiawasch Abedjan,2023,https://link.springer.com/article/10.1007/s00778-023-00820-1,Article
Contact tracing apps for the COVID-19 pandemic: a systematic literature review of challenges and future directions for neo-liberal societies,Health Information Science and Systems,,,,10.1007/s13755-021-00147-7,Alex AkinbiMark ForshawVictoria Blinkhorn,2021,https://link.springer.com/article/10.1007/s13755-021-00147-7,Article
Computational approaches to detect experts in distributed online communities: a case study on Reddit,Cluster Computing,,,,10.1007/s10586-023-04076-w,Sofia StrukovaJosé A. Ruipérez-ValienteFélix Gómez Mármol,2023,https://link.springer.com/article/10.1007/s10586-023-04076-w,Article
One step ahead: mapping the Italian and German cybersecurity laws against the proposal for a&#xa0;NIS2 directive,International Cybersecurity Law Review,,,,10.1365/s43439-022-00058-7,Sandra Schmitz-BerndtPier Giorgio Chiara,2022,https://link.springer.com/article/10.1365/s43439-022-00058-7,Article
Data- &amp; compute-efficient deviance mining via active learning and fast ensembles,Journal of Intelligent Information Systems,,,,10.1007/s10844-024-00841-4,Francesco FolinoGianluigi FolinoMassimo GuarascioLuigi Pontieri,2024,https://link.springer.com/article/10.1007/s10844-024-00841-4,Article
Privacy-preserving decision tree for epistasis detection,Cybersecurity,,,,10.1186/s42400-019-0025-z,Qingfeng ChenXu ZhangRuchang Zhang,2019,https://link.springer.com/article/10.1186/s42400-019-0025-z,Article
An extended study of syntactic breaking changes in the wild,Empirical Software Engineering,,,,10.1007/s10664-024-10563-4,Dhanushka JayasuriyaSamuel OuSaakshi HegdeValerio TerragniJens DietrichKelly Blincoe,2024,https://link.springer.com/article/10.1007/s10664-024-10563-4,Article
Addressing ethical challenges in automated vehicles: bridging the gap with hybrid AI and augmented utilitarianism,AI and Ethics,,,,10.1007/s43681-024-00592-6,Chloe GrosLeon KesterMarieke MartensPeter Werkhoven,2024,https://link.springer.com/article/10.1007/s43681-024-00592-6,Article
Analyzing digital propaganda and conflict rhetoric: a study on Russia’s bot-driven campaigns and counter-narratives during the Ukraine crisis,Social Network Analysis and Mining,,,,10.1007/s13278-024-01322-w,Rebecca MariglianoLynnette Hui Xian NgKathleen M. Carley,2024,https://link.springer.com/article/10.1007/s13278-024-01322-w,Article
Keyword-labeled self-admitted technical debt and static code analysis have significant relationship but limited overlap,Software Quality Journal,,,,10.1007/s11219-023-09655-z,Leevi RantalaMika MäntyläValentina Lenarduzzi,2023,https://link.springer.com/article/10.1007/s11219-023-09655-z,Article
AI for crisis decisions,Ethics and Information Technology,,,,10.1007/s10676-024-09750-0,Tina Comes,2024,https://link.springer.com/article/10.1007/s10676-024-09750-0,Article
Strong and weak AI narratives: an analytical framework,AI & SOCIETY,,,,10.1007/s00146-024-02087-8,Paolo BorySimone NataleChristian Katzenbach,2024,https://link.springer.com/article/10.1007/s00146-024-02087-8,Article
Process Mining in Trusted Execution Environments: Towards Hardware Guarantees for Trust-Aware Inter-organizational Process Analysis,Process Mining Workshops,,,,10.1007/978-3-030-98581-3_27,Marcel MüllerAnthony Simonet-BoulogneSouvik SenguptaOliver Beige,2022,https://link.springer.com/chapter/10.1007/978-3-030-98581-3_27,Conference paper
Energy-Efficient and Load-Aware VM Placement in Cloud Data Centers,Journal of Grid Computing,,,,10.1007/s10723-022-09631-0,Zhihua LiKaiqing LinShunhang ChengLei YuJunhao Qian,2022,https://link.springer.com/article/10.1007/s10723-022-09631-0,Article
“Chatty Devices” and edge-based activity classification,Discover Internet of Things,,,,10.1007/s43926-021-00004-9,Mike LakojuAmir JavedOmer RanaPete BurnapSamuelson T. AtibaSoumaya Cherkaoui,2021,https://link.springer.com/article/10.1007/s43926-021-00004-9,Article
Standardizing fairness-evaluation procedures: interdisciplinary insights on machine learning algorithms in creditworthiness assessments for small personal loans,AI and Ethics,,,,10.1007/s43681-023-00291-8,Sergio GenovesiJulia Maria MönigAnna SchmitzMaximilian PoretschkinMaram AkilaManoj KahdanRomina KleinerLena KriegerAlexander Zimmermann,2023,https://link.springer.com/article/10.1007/s43681-023-00291-8,Article
Robotics in Healthcare: A Survey,SN Computer Science,,,,10.1007/s42979-023-02551-0,David Silvera-Tawil,2024,https://link.springer.com/article/10.1007/s42979-023-02551-0,Article
ATENA: Adaptive TEchniques for Network Area Coverage and Routing in IoT-Based Edge Computing,Journal of Network and Systems Management,,,,10.1007/s10922-024-09856-2,Garrik Brel Jagho MdemayaVianney Kengne TchendjiMthulisi VelempiniAriege Atchaze,2024,https://link.springer.com/article/10.1007/s10922-024-09856-2,Article
Robotics in place and the places of robotics: productive tensions across human geography and human–robot interaction,AI & SOCIETY,,,,10.1007/s00146-024-01995-z,Casey R. LynchBethany N. ManaloÀlex Muñoz-Viso,2024,https://link.springer.com/article/10.1007/s00146-024-01995-z,Article
Socialisation approach to AI value acquisition: enabling flexible ethical navigation with built-in receptiveness to social influence,AI and Ethics,,,,10.1007/s43681-023-00372-8,Joel Janhonen,2023,https://link.springer.com/article/10.1007/s43681-023-00372-8,Article
European Cybersecurity Certification Schemes and cybersecurity in the EU internal market,International Cybersecurity Law Review,,,,10.1365/s43439-021-00044-5,Donald David Stewart Ferguson,2022,https://link.springer.com/article/10.1365/s43439-021-00044-5,Article
"A systematic review of factors, data sources, and prediction techniques for earlier prediction of traffic collision using AI and machine Learning",Multimedia Tools and Applications,,,,10.1007/s11042-024-19599-6,Nandkumar NitureIheb Abdellatif,2024,https://link.springer.com/article/10.1007/s11042-024-19599-6,Article
In the hands of users with intellectual disabilities: co-designing tangible user interfaces for mental wellbeing,Personal and Ubiquitous Computing,,,,10.1007/s00779-023-01752-x,Kieran WoodwardEiman KanjoDavid J. BrownT. M. McGinnityGordon Harold,2023,https://link.springer.com/article/10.1007/s00779-023-01752-x,Article
NLP-based platform as a service: a brief review,Journal of Big Data,,,,10.1186/s40537-022-00603-5,Sebastião PaisJoão CordeiroM. Luqman Jamil,2022,https://link.springer.com/article/10.1186/s40537-022-00603-5,Article
<span>StateAFL</span>: Greybox fuzzing for stateful network servers,Empirical Software Engineering,,,,10.1007/s10664-022-10233-3,Roberto Natella,2022,https://link.springer.com/article/10.1007/s10664-022-10233-3,Article
Constructive Criticism? Working with (Rather than Against) the AIED Back-Lash,International Journal of Artificial Intelligence in Education,,,,10.1007/s40593-023-00344-3,Neil Selwyn,2023,https://link.springer.com/article/10.1007/s40593-023-00344-3,Article
LSTM RNN: detecting exploit kits using redirection chain sequences,Cybersecurity,,,,10.1186/s42400-021-00093-7,Jonah BurgessPhilip O’KaneSakir SezerDomhnall Carlin,2021,https://link.springer.com/article/10.1186/s42400-021-00093-7,Article
An Explorative Study into the Importance of Defining and Classifying Cyber Terrorism in the United Kingdom,SN Computer Science,,,,10.1007/s42979-021-00962-5,Victoria Jangada Correia,2021,https://link.springer.com/article/10.1007/s42979-021-00962-5,Article
Allotaxonometry and rank-turbulence divergence: a universal instrument for comparing complex systems,EPJ Data Science,,,,10.1140/epjds/s13688-023-00400-x,Peter Sheridan DoddsJoshua R. MinotMichael V. ArnoldThayer AlshaabiJane Lydia AdamsDavid Rushing DewhurstTyler J. GrayMorgan R. FrankAndrew J. ReaganChristopher M. Danforth,2023,https://link.springer.com/article/10.1140/epjds/s13688-023-00400-x,Article
Active learning for data streams: a survey,Machine Learning,,,,10.1007/s10994-023-06454-2,Davide CacciarelliMurat Kulahci,2023,https://link.springer.com/article/10.1007/s10994-023-06454-2,Article
Adopting the&#xa0;Internet of&#xa0;Things Technology to&#xa0;Remotely Monitor COVID-19 Patients,Participative Urban Health and Healthy Aging in the Age of AI,,,,10.1007/978-3-031-09593-1_13,Abdessamad SaidiMohamed Hadj KacemImen TounsiAhmed Hadj Kacem,2022,https://link.springer.com/chapter/10.1007/978-3-031-09593-1_13,Conference paper
3D face recognition: A comprehensive survey in 2022,Computational Visual Media,,,,10.1007/s41095-022-0317-1,Yaping JingXuequan LuShang Gao,2023,https://link.springer.com/article/10.1007/s41095-022-0317-1,Article
Cyber security incidents analysis and classification in a case study of Korean enterprises,Knowledge and Information Systems,,,,10.1007/s10115-020-01452-5,Alaa MohassebBenjamin AzizJeyong JungJulak Lee,2020,https://link.springer.com/article/10.1007/s10115-020-01452-5,Article
Milestones in speaker recognition,Artificial Intelligence Review,,,,10.1007/s10462-023-10688-w,R. SharmaD. GovindJ. MishraA. K. DubeyK. T. DeepakS. R. M. Prasanna,2024,https://link.springer.com/article/10.1007/s10462-023-10688-w,Article
Coupling multifunction drones with AI in the fight against the coronavirus pandemic,Computing,,,,10.1007/s00607-021-01022-9,Faris A. AlmalkiAbdullah A. AlotaibiMarios C. Angelides,2021,https://link.springer.com/article/10.1007/s00607-021-01022-9,Article
An end-to-end convolutional network for joint detecting and denoising adversarial perturbations in vehicle classification,Computational Visual Media,,,,10.1007/s41095-021-0202-3,Peng LiuHuiyuan FuHuadong Ma,2021,https://link.springer.com/article/10.1007/s41095-021-0202-3,Article
Analyzing FOSS license usage in publicly available software at scale via the SWH-analytics framework,The Journal of Supercomputing,,,,10.1007/s11227-024-06069-x,Alessia AntelmiMassimo TorquatiGiacomo CorridoriDaniele GregoriFrancesco PolzellaGianmarco SpinatelliMarco Aldinucci,2024,https://link.springer.com/article/10.1007/s11227-024-06069-x,Article
A Strategy for Predicting the Performance of Supervised and Unsupervised Tabular Data Classifiers,Data Science and Engineering,,,,10.1007/s41019-024-00264-9,Tommaso ZoppiAndrea CeccarelliAndrea Bondavalli,2024,https://link.springer.com/article/10.1007/s41019-024-00264-9,Article
Using driver monitoring to estimate readiness in automation: a conceptual model based on simulator experimental data,"Cognition, Technology & Work",,,,10.1007/s10111-024-00777-3,Rafael C. GonçalvesCourtney M. GoodridgeJonny KuoMike G. LennéNatasha Merat,2024,https://link.springer.com/article/10.1007/s10111-024-00777-3,Article
Exploiting beam search confidence for energy-efficient speech recognition,The Journal of Supercomputing,,,,10.1007/s11227-024-06351-y,Dennis PintoJosé-María ArnauMarc RieraJosep-Llorenç CruzAntonio González,2024,https://link.springer.com/article/10.1007/s11227-024-06351-y,Article
"Efficient artificial intelligence approaches for medical image processing in healthcare: comprehensive review, taxonomy, and analysis",Artificial Intelligence Review,,,,10.1007/s10462-024-10814-2,Omar Abdullah Murshed Farhan AlnaggarBasavaraj N. JagadaleMufeed Ahmed Naji SaifOsamah A. M. GhalebAmmar A. Q. AhmedHesham Abdo Ahmed AqlanHasib Daowd Esmail Al-Ariki,2024,https://link.springer.com/article/10.1007/s10462-024-10814-2,Article
WiFi-Based Human Activity Recognition Using Attention-Based BiLSTM,Artificial Intelligence and Cognitive Science,,,,10.1007/978-3-031-26438-2_10,Amany ElkelanyRobert RossSusan Mckeever,2023,https://link.springer.com/chapter/10.1007/978-3-031-26438-2_10,Conference paper
Exploring solutions to the privacy paradox in the context of e-assessment: informed consent revisited,Ethics and Information Technology,,,,10.1007/s10676-020-09531-5,Ekaterina MuravyevaJosé JanssenMarcus SpechtBart Custers,2020,https://link.springer.com/article/10.1007/s10676-020-09531-5,Article
Uncovering Flat and Hierarchical Topics by Community Discovery on Word Co-occurrence Network,Data Science and Engineering,,,,10.1007/s41019-023-00239-2,Eric AustinShraddha MakwanaAmine TrabelsiChristine LargeronOsmar R. Zaïane,2024,https://link.springer.com/article/10.1007/s41019-023-00239-2,Article
Real-Time Multiple Object Tracking for&#xa0;Safe Cooking Activities,"Digital Health Transformation, Smart Ageing, and Managing Disability",,,,10.1007/978-3-031-43950-6_17,Hubert NgankamPhilippe DionHélène PigotSylvain Giroux,2023,https://link.springer.com/chapter/10.1007/978-3-031-43950-6_17,Conference paper
Targeted adversarial attacks on wind power forecasts,Machine Learning,,,,10.1007/s10994-023-06396-9,René HeinrichChristoph ScholzStephan VogtMalte Lehna,2023,https://link.springer.com/article/10.1007/s10994-023-06396-9,Article
D-Cloud-Collector: Admissible Forensic Evidence from&#xa0;Mobile Cloud Storage,ICT Systems Security and Privacy Protection,,,,10.1007/978-3-031-06975-8_10,Mark VellaChristian Colombo,2022,https://link.springer.com/chapter/10.1007/978-3-031-06975-8_10,Conference paper
A DGA domain names detection modeling method based on integrating an attention mechanism and deep neural network,Cybersecurity,,,,10.1186/s42400-020-00046-6,Fangli RenZhengwei JiangXuren WangJian Liu,2020,https://link.springer.com/article/10.1186/s42400-020-00046-6,Article
Fall prediction using behavioural modelling from sensor data in smart homes,Artificial Intelligence Review,,,,10.1007/s10462-019-09687-7,Glenn ForbesStewart MassieSusan Craw,2019,https://link.springer.com/article/10.1007/s10462-019-09687-7,Article
Hierarchical reinforcement learning for efficient and effective automated penetration testing of large networks,Journal of Intelligent Information Systems,,,,10.1007/s10844-022-00738-0,Mohamed C. GhanemThomas M. ChenErivelton G. Nepomuceno,2022,https://link.springer.com/article/10.1007/s10844-022-00738-0,Article
Enhancing smart home interaction through multimodal command disambiguation,Personal and Ubiquitous Computing,,,,10.1007/s00779-024-01827-3,Tommaso CalòLuigi De Russis,2024,https://link.springer.com/article/10.1007/s00779-024-01827-3,Article
Deep learning based topic and sentiment analysis: COVID19 information seeking on social media,Social Network Analysis and Mining,,,,10.1007/s13278-022-00917-5,Md Abul BasharRichi NayakThirunavukarasu Balasubramaniam,2022,https://link.springer.com/article/10.1007/s13278-022-00917-5,Article
