Item Title,Publication Title,Book Series Title,Journal Volume,Journal Issue,Item DOI,Authors,Publication Year,URL,Content Type
Deep learning for computer vision based activity recognition and fall detection of the elderly: a systematic review,Applied Intelligence,,,,10.1007/s10489-024-05645-1,F. Xavier Gaya-MoreyCristina Manresa-YeeJosé M. Buades-Rubio,2024,https://link.springer.com/article/10.1007/s10489-024-05645-1,Article
"Video analytic system for activity profiling, fall detection, and unstable motion detection",Multimedia Tools and Applications,,,,10.1007/s11042-023-14993-y,Aniqua Nusrat ZereenAnubinda GurungAmir RajakJednipat MoonrintaMatthew N. DaileyMongkol EkpanyapongRoongtiwa VachalathitiSunee Bovonsunthonchai,2023,https://link.springer.com/article/10.1007/s11042-023-14993-y,Article
Security and privacy in virtual reality: a literature survey,Virtual Reality,,,,10.1007/s10055-024-01079-9,Alberto Giaretta,2024,https://link.springer.com/article/10.1007/s10055-024-01079-9,Article
Privacy-Aware Anomaly Detection in IoT Environments using FedGroup: A Group-Based Federated Learning Approach,Journal of Network and Systems Management,,,,10.1007/s10922-023-09782-9,Yixuan ZhangBasem SuleimanMuhammad Johan AlibasaFarnaz Farid,2024,https://link.springer.com/article/10.1007/s10922-023-09782-9,Article
Trustworthy machine learning in the context of security and privacy,International Journal of Information Security,,,,10.1007/s10207-024-00813-3,Ramesh UpretiPedro G. LindAhmed ElmokashfiAnis Yazidi,2024,https://link.springer.com/article/10.1007/s10207-024-00813-3,Article
A review of time-series analysis for cyber security analytics: from intrusion detection to attack prediction,International Journal of Information Security,,,,10.1007/s10207-024-00921-0,Max LandauerFlorian SkopikBranka StojanovićAndreas FlatscherTorsten Ullrich,2024,https://link.springer.com/article/10.1007/s10207-024-00921-0,Article
Using efficient deep learning techniques for mobile crowd sensing detection in an IOTA-based framework,Discover Computing,,,,10.1007/s10791-024-09493-y,Mohammed Naif Alatawi,2024,https://link.springer.com/article/10.1007/s10791-024-09493-y,Article
Anomaly detection and defense techniques in federated learning: a comprehensive review,Artificial Intelligence Review,,,,10.1007/s10462-024-10796-1,Chang ZhangShunkun YangLingfeng MaoHuansheng Ning,2024,https://link.springer.com/article/10.1007/s10462-024-10796-1,Article
A large-scale data security detection method based on continuous time graph embedding framework,Journal of Cloud Computing,,,,10.1186/s13677-023-00460-4,Zhaowei LiuWeishuai CheShenqiang WangJindong XuHaoyu Yin,2023,https://link.springer.com/article/10.1186/s13677-023-00460-4,Article
Staying ahead of phishers: a review of recent advances and emerging methodologies in phishing detection,Artificial Intelligence Review,,,,10.1007/s10462-024-11055-z,S. KavyaD. Sumathi,2024,https://link.springer.com/article/10.1007/s10462-024-11055-z,Article
Ubiquitous multi-occupant detection in smart environments,Neural Computing and Applications,,,,10.1007/s00521-023-09162-z,Daniel FährmannFadi BoutrosPhilipp KubonFlorian KirchbuchnerArjan KuijperNaser Damer,2023,https://link.springer.com/article/10.1007/s00521-023-09162-z,Article
Zero-day Android botnet detection using neural networks,Neural Computing and Applications,,,,10.1007/s00521-024-10818-7,Saeed SerajElias PimenidisMarcello TrovatiNikolaos Polatidis,2024,https://link.springer.com/article/10.1007/s00521-024-10818-7,Article
Virtual reality in training artificial intelligence-based systems: a case study of fall detection,Multimedia Tools and Applications,,,,10.1007/s11042-022-13080-y,Vinh BuiAlireza Alaei,2022,https://link.springer.com/article/10.1007/s11042-022-13080-y,Article
Thermal Imaging in Robotics as a Privacy-Enhancing or Privacy-Invasive Measure? Misconceptions of Privacy when Using Thermal Cameras in Robots,Digital Society,,,,10.1007/s44206-023-00060-4,Naomi Lintvedt,2023,https://link.springer.com/article/10.1007/s44206-023-00060-4,Article
The survey on the dual nature of xAI challenges in intrusion detection and their potential for AI innovation,Artificial Intelligence Review,,,,10.1007/s10462-024-10972-3,Marek PawlickiAleksandra PawlickaRafał KozikMichał Choraś,2024,https://link.springer.com/article/10.1007/s10462-024-10972-3,Article
Exploring user privacy awareness on GitHub: an empirical study,Empirical Software Engineering,,,,10.1007/s10664-024-10544-7,Costanza AlfieriJuri Di RoccoPaola InverardiPhuong T. Nguyen,2024,https://link.springer.com/article/10.1007/s10664-024-10544-7,Article
"Trends, prospects, challenges, and security in the healthcare internet of things",Computing,,,,10.1007/s00607-024-01352-4,Tariq Emad AliFaten Imad AliPavle DakićAlwahab Dhulfiqar Zoltan,2024,https://link.springer.com/article/10.1007/s00607-024-01352-4,Article
A fog-edge-enabled intrusion detection system for smart grids,Journal of Cloud Computing,,,,10.1186/s13677-024-00609-9,Noshina TariqAmjad AlsirhaniMamoona HumayunFaeiz AlserhaniMomina Shaheen,2024,https://link.springer.com/article/10.1186/s13677-024-00609-9,Article
Privacy-preserving explainable AI: a survey,Science China Information Sciences,,,,10.1007/s11432-024-4123-4,Thanh Tam NguyenThanh Trung HuynhZhao RenThanh Toan NguyenPhi Le NguyenHongzhi YinQuoc Viet Hung Nguyen,2024,https://link.springer.com/article/10.1007/s11432-024-4123-4,Article
Explainable deep learning approach for advanced persistent threats (APTs) detection in cybersecurity: a review,Artificial Intelligence Review,,,,10.1007/s10462-024-10890-4,Noor Hazlina Abdul MutalibAznul Qalid Md SabriAinuddin Wahid Abdul WahabErma Rahayu Mohd Faizal AbdullahNouar AlDahoul,2024,https://link.springer.com/article/10.1007/s10462-024-10890-4,Article
Enhanced anomaly traffic detection framework using BiGAN and contrastive learning,Cybersecurity,,,,10.1186/s42400-024-00297-7,Haoran YuWenchuan YangBaojiang CuiRunqi SuiXuedong Wu,2024,https://link.springer.com/article/10.1186/s42400-024-00297-7,Article
Enhancing resilience in complex energy systems through real-time anomaly detection: a systematic literature review,Energy Informatics,,,,10.1186/s42162-024-00401-8,Ali Aghazadeh ArdebiliOussama HasidiAhmed BendaouiaAdem KhalilSabri KhalilDalila LuceriAntonella LongoEl Hassan AbdelwahedSara QassimiAntonio Ficarella,2024,https://link.springer.com/article/10.1186/s42162-024-00401-8,Article
Enhancing network intrusion detection systems with combined network and host traffic features using deep learning: deep learning and IoT perspective,Discover Computing,,,,10.1007/s10791-024-09480-3,Estabraq Saleem Abduljabbar AlarsSefer Kurnaz,2024,https://link.springer.com/article/10.1007/s10791-024-09480-3,Article
Research trends in deep learning and machine learning for cloud computing security,Artificial Intelligence Review,,,,10.1007/s10462-024-10776-5,Yehia Ibrahim AlzoubiAlok MishraAhmet Ercan Topcu,2024,https://link.springer.com/article/10.1007/s10462-024-10776-5,Article
Advancing cybersecurity: a comprehensive review of AI-driven detection techniques,Journal of Big Data,,,,10.1186/s40537-024-00957-y,Aya H. SalemSafaa M. AzzamO. E. EmamAmr A. Abohany,2024,https://link.springer.com/article/10.1186/s40537-024-00957-y,Article
AI hype as a cyber security risk: the moral responsibility of implementing generative AI in business,AI and Ethics,,,,10.1007/s43681-024-00443-4,Declan HumphreysAbigail KoayDennis DesmondErica Mealy,2024,https://link.springer.com/article/10.1007/s43681-024-00443-4,Article
DDoS attack detection techniques in IoT networks: a survey,Cluster Computing,,,,10.1007/s10586-024-04662-6,Amir PakmehrAndreas AßmuthNegar TaheriAli Ghaffari,2024,https://link.springer.com/article/10.1007/s10586-024-04662-6,Article
Artificial intelligence for system security assurance: A systematic literature review,International Journal of Information Security,,,,10.1007/s10207-024-00959-0,Shao-Fang WenAnkur ShuklaBasel Katt,2024,https://link.springer.com/article/10.1007/s10207-024-00959-0,Article
A comprehensive survey of deep learning-based lightweight object detection models for edge devices,Artificial Intelligence Review,,,,10.1007/s10462-024-10877-1,Payal Mittal,2024,https://link.springer.com/article/10.1007/s10462-024-10877-1,Article
A hybrid approach for efficient feature selection in anomaly intrusion detection for IoT networks,The Journal of Supercomputing,,,,10.1007/s11227-024-06409-x,Aya G. AyadNehal A. SakrNoha A. Hikal,2024,https://link.springer.com/article/10.1007/s11227-024-06409-x,Article
Deep learning for lungs cancer detection: a review,Artificial Intelligence Review,,,,10.1007/s10462-024-10807-1,Rabia JavedTahir AbbasAli Haider KhanAli DaudAmal BukhariRiad Alharbey,2024,https://link.springer.com/article/10.1007/s10462-024-10807-1,Article
Classification and security assessment of android apps,Discover Internet of Things,,,,10.1007/s43926-023-00047-0,Eralda CaushajVijayan Sugumaran,2023,https://link.springer.com/article/10.1007/s43926-023-00047-0,Article
Cumulative histogram as a feature selection technique for anomaly detection,Multimedia Tools and Applications,,,,10.1007/s11042-023-17617-7,Mostafa NassarRania A. SalamaAdel A. SaleebNirmeen A. El-bahnasawyHossam Eldin H. AhmedFathi E. Abd El-Samie,2024,https://link.springer.com/article/10.1007/s11042-023-17617-7,Article
A bizarre synthesized cascaded optimized predictor (BizSCOP) model for enhancing security in cloud systems,Journal of Cloud Computing,,,,10.1186/s13677-024-00657-1,R. Julian MenezesP. Jesu JayarinA. Chandra Sekar,2024,https://link.springer.com/article/10.1186/s13677-024-00657-1,Article
Wind power prediction method based on cloud computing and data privacy protection,Journal of Cloud Computing,,,,10.1186/s13677-024-00679-9,Lei ZhangShaoming ZhuShen SuXiaofeng ChenYan YangBing Zhou,2024,https://link.springer.com/article/10.1186/s13677-024-00679-9,Article
A convolution neural network approach for fall detection based on adaptive channel selection of UWB radar signals,Neural Computing and Applications,,,,10.1007/s00521-021-06795-w,Ping WangQimeng LiPeng YinZhonghao WangYu LingRaffaele GravinaYe Li,2022,https://link.springer.com/article/10.1007/s00521-021-06795-w,Article
MADESANT: malware detection and severity analysis in industrial environments,Cluster Computing,,,,10.1007/s10586-024-04527-y,P. L. S. JayalaxmiManali ChakrabortyRahul SahaGulshan KumarMauro Conti,2024,https://link.springer.com/article/10.1007/s10586-024-04527-y,Article
"Architectural views for social robots in public spaces: business, system, and security strategies",International Journal of Information Security,,,,10.1007/s10207-024-00924-x,Samson OrumaRicardo Colomo-PalaciosVasileios Gkioulos,2024,https://link.springer.com/article/10.1007/s10207-024-00924-x,Article
Securing data and preserving privacy in cloud IoT-based technologies an analysis of assessing threats and developing effective safeguard,Artificial Intelligence Review,,,,10.1007/s10462-024-10908-x,Mayank PathakKamta Nath MishraSatya Prakash Singh,2024,https://link.springer.com/article/10.1007/s10462-024-10908-x,Article
"A Comprehensive Survey on Trustworthy Graph Neural Networks: Privacy, Robustness, Fairness, and Explainability",Machine Intelligence Research,,,,10.1007/s11633-024-1510-8,Enyan DaiTianxiang ZhaoHuaisheng ZhuJunjie XuZhimeng GuoHui LiuJiliang TangSuhang Wang,2024,https://link.springer.com/article/10.1007/s11633-024-1510-8,Article
Dynamic Multi-Method Allocation for Intent-based Security Orchestration,Journal of Network and Systems Management,,,,10.1007/s10922-024-09896-8,Alberto Robles-EncisoJosé Manuel Bernabé MurciaAlejandro Molina ZarcaAntonio Skarmeta Gomez,2024,https://link.springer.com/article/10.1007/s10922-024-09896-8,Article
Robustness in deep learning models for medical diagnostics: security and adversarial challenges towards robust AI applications,Artificial Intelligence Review,,,,10.1007/s10462-024-11005-9,Haseeb JavedShaker El-SappaghTamer Abuhmed,2024,https://link.springer.com/article/10.1007/s10462-024-11005-9,Article
Mirroring Privacy Risks with Digital Twins: When Pieces of Personal Data Suddenly Fit Together,SN Computer Science,,,,10.1007/s42979-024-03413-z,Frederik Simon BäumerSergej SchultenkämperMichaela GeierhosYeong Su Lee,2024,https://link.springer.com/article/10.1007/s42979-024-03413-z,Article
Explainable AI-based innovative hybrid ensemble model for intrusion detection,Journal of Cloud Computing,,,,10.1186/s13677-024-00712-x,Usman AhmedZheng JiangbinAhmad AlmogrenSheharyar KhanMuhammad Tariq SadiqAyman AltameemAteeq Ur Rehman,2024,https://link.springer.com/article/10.1186/s13677-024-00712-x,Article
"A multifaceted survey on privacy preservation of federated learning: progress, challenges, and opportunities",Artificial Intelligence Review,,,,10.1007/s10462-024-10766-7,Sanchita SahaAshlesha HotaArup Kumar ChattopadhyayAmitava NagSukumar Nandi,2024,https://link.springer.com/article/10.1007/s10462-024-10766-7,Article
Automated subway touch button detection using image process,Journal of Big Data,,,,10.1186/s40537-024-00941-6,Junfeng AnMengmeng LuGang LiJiqiang LiuChongqing Wang,2024,https://link.springer.com/article/10.1186/s40537-024-00941-6,Article
"ChatGPT Needs SPADE (Sustainability, PrivAcy, Digital divide, and Ethics) Evaluation: A Review",Cognitive Computation,,,,10.1007/s12559-024-10285-1,Sunder Ali KhowajaParus KhuwajaKapal DevWeizheng WangLewis Nkenyereye,2024,https://link.springer.com/article/10.1007/s12559-024-10285-1,Article
Enhancing IoT Security: A Blockchain-Based Mitigation Framework for Deauthentication Attacks,International Journal of Networked and Distributed Computing,,,,10.1007/s44227-024-00029-w,S. Harihara GopalanA. ManikandanN. P. DharaniG. Sujatha,2024,https://link.springer.com/article/10.1007/s44227-024-00029-w,Article
RPL-based attack detection approaches in IoT networks: review and taxonomy,Artificial Intelligence Review,,,,10.1007/s10462-024-10907-y,Nadia AlfriehatMohammed AnbarMohammed AladailehIznan HasbullahTamarah A. ShurbajiShankar KaruppayahAmmar Almomani,2024,https://link.springer.com/article/10.1007/s10462-024-10907-y,Article
Explainable depression symptom detection in social media,Health Information Science and Systems,,,,10.1007/s13755-024-00303-9,Eliseo BaoAnxo PérezJavier Parapar,2024,https://link.springer.com/article/10.1007/s13755-024-00303-9,Article
Cyberattack detection in wireless sensor networks using a hybrid feature reduction technique with AI and machine learning methods,Journal of Big Data,,,,10.1186/s40537-023-00870-w,Mohamed H. BehiryMohammed Aly,2024,https://link.springer.com/article/10.1186/s40537-023-00870-w,Article
Online boxplot derived outlier detection,International Journal of Data Science and Analytics,,,,10.1007/s41060-024-00559-0,Arefeh MazareiRicardo SousaJoão Mendes-MoreiraSlavo MolchanovHugo Miguel Ferreira,2024,https://link.springer.com/article/10.1007/s41060-024-00559-0,Article
Real-time violence detection and localization through subgroup analysis,Multimedia Tools and Applications,,,,10.1007/s11042-024-19144-5,Emmeke VeltmeijerMorris FrankenCharlotte Gerritsen,2024,https://link.springer.com/article/10.1007/s11042-024-19144-5,Article
SMoTeF: Smurf money laundering detection using temporal order and flow analysis,Applied Intelligence,,,,10.1007/s10489-024-05545-4,Shiva ShadroohKjetil Nørvåg,2024,https://link.springer.com/article/10.1007/s10489-024-05545-4,Article
From the Lab to the Wild: Examining Generalizability of Video-based Mind Wandering Detection,International Journal of Artificial Intelligence in Education,,,,10.1007/s40593-024-00412-2,Babette BühlerEfe BozkirPatricia GoldbergÖmer SümerSidney D’MelloPeter GerjetsUlrich TrautweinEnkelejda Kasneci,2024,https://link.springer.com/article/10.1007/s40593-024-00412-2,Article
Anomaly-based intrusion detection system for IoT application,Discover Internet of Things,,,,10.1007/s43926-023-00034-5,Mansi BhavsarKaushik RoyJohn KellyOdeyomi Olusola,2023,https://link.springer.com/article/10.1007/s43926-023-00034-5,Article
Transformative synergy: SSEHCET—bridging mobile edge computing and AI for enhanced eHealth security and efficiency,Journal of Cloud Computing,,,,10.1186/s13677-024-00602-2,Mamoona HumayunAmjad AlsirhaniFaeiz AlserhaniMomina ShaheenGhadah Alwakid,2024,https://link.springer.com/article/10.1186/s13677-024-00602-2,Article
Underwater image processing and target detection from particle swarm optimization algorithm,"Signal, Image and Video Processing",,,,10.1007/s11760-024-03638-8,Yangmei ZhangYang BiJunfang Li,2024,https://link.springer.com/article/10.1007/s11760-024-03638-8,Article
Enhancing IoT intrusion detection through machine learning with AN-SFS: a novel approach to high performing adaptive feature selection,Discover Internet of Things,,,,10.1007/s43926-024-00074-5,Supongmen WallingSibesh Lodh,2024,https://link.springer.com/article/10.1007/s43926-024-00074-5,Article
Comparison of deep learning algorithms for site detection of false data injection attacks in smart grids,Energy Informatics,,,,10.1186/s42162-024-00381-9,Qassim NasirManar Abu TalibMuhammad Arbab ArshadTracy IshakRomaissa BerrimBasma AlsaidYoussef BadwayOmnia Abu Waraga,2024,https://link.springer.com/article/10.1186/s42162-024-00381-9,Article
Enhanced detection of obfuscated malware in memory dumps: a machine learning approach for advanced cybersecurity,Cybersecurity,,,,10.1186/s42400-024-00205-z,Md. Alamgir HossainMd. Saiful Islam,2024,https://link.springer.com/article/10.1186/s42400-024-00205-z,Article
"Investigation on storage level data integrity strategies in cloud computing: classification, security obstructions, challenges and vulnerability",Journal of Cloud Computing,,,,10.1186/s13677-024-00605-z,Paromita GoswamiNeetu FaujdarSomen DebnathAjoy Kumar KhanGhanshyam Singh,2024,https://link.springer.com/article/10.1186/s13677-024-00605-z,Article
A multi-classification detection model for imbalanced data in NIDS based on reconstruction and feature matching,Journal of Cloud Computing,,,,10.1186/s13677-023-00584-7,Yue YangJieren ChengZhaowu LiuHuimin LiGanglou Xu,2024,https://link.springer.com/article/10.1186/s13677-023-00584-7,Article
Deep Learning Based Hybrid Intrusion Detection Systems to Protect Satellite Networks,Journal of Network and Systems Management,,,,10.1007/s10922-023-09767-8,Ahmad Taher AzarEsraa ShehabAhmed M. MattarIbrahim A. HameedShaimaa Ahmed Elsaid,2023,https://link.springer.com/article/10.1007/s10922-023-09767-8,Article
Pimo: memory-efficient privacy protection in video streaming and analytics,Multimedia Systems,,,,10.1007/s00530-024-01337-5,Jie YuanZicong WangTingting YuanJing ZhangRui Qian,2024,https://link.springer.com/article/10.1007/s00530-024-01337-5,Article
Generalisable sensor-free frustration detection in online learning environments using machine learning,User Modeling and User-Adapted Interaction,,,,10.1007/s11257-024-09402-4,Mohammad Mustaneer RahmanRobert OllingtonSoonja YeomNadia Ollington,2024,https://link.springer.com/article/10.1007/s11257-024-09402-4,Article
Maximizing intrusion detection efficiency for IoT networks using extreme learning machine,Discover Internet of Things,,,,10.1007/s43926-024-00060-x,Shahad AltamimiQasem Abu Al-Haija,2024,https://link.springer.com/article/10.1007/s43926-024-00060-x,Article
Community detection in social networks using machine learning: a systematic mapping study,Knowledge and Information Systems,,,,10.1007/s10115-024-02201-8,Mahsa NooribakhshMarta Fernández-DiegoFernando González-Ladrón-De-GuevaraMahdi Mollamotalebi,2024,https://link.springer.com/article/10.1007/s10115-024-02201-8,Article
Comparison of home detection algorithms using smartphone GPS data,EPJ Data Science,,,,10.1140/epjds/s13688-023-00447-w,Rajat VermaShagun MittalZengxiang LeiXiaowei ChenSatish V. Ukkusuri,2024,https://link.springer.com/article/10.1140/epjds/s13688-023-00447-w,Article
Anomaly Detection in Cloud Computing using Knowledge Graph Embedding and Machine Learning Mechanisms,Journal of Grid Computing,,,,10.1007/s10723-023-09727-1,Katerina MitropoulouPanagiotis KokkinosPolyzois SoumplisEmmanouel Varvarigos,2023,https://link.springer.com/article/10.1007/s10723-023-09727-1,Article
"<Emphasis FontCategory=""SansSerif"">PANACEA</Emphasis>: a neural model ensemble for cyber-threat detection",Machine Learning,,,,10.1007/s10994-023-06470-2,Malik AL-EssaGiuseppina AndresiniAnnalisa AppiceDonato Malerba,2024,https://link.springer.com/article/10.1007/s10994-023-06470-2,Article
Data portability for activities of daily living and fall detection in different environments using radar micro-doppler,Neural Computing and Applications,,,,10.1007/s00521-022-06886-2,Syed Aziz ShahAhsen TahirJulien Le KernecAhmed ZohaFrancesco Fioranelli,2022,https://link.springer.com/article/10.1007/s00521-022-06886-2,Article
A survey of model compression strategies for object detection,Multimedia Tools and Applications,,,,10.1007/s11042-023-17192-x,Zonglei LyuTong YuFuxi PanYilin ZhangJia LuoDan ZhangYiren ChenBo ZhangGuangyao Li,2023,https://link.springer.com/article/10.1007/s11042-023-17192-x,Article
Human-centric and semantics-based explainable event detection: a survey,Artificial Intelligence Review,,,,10.1007/s10462-023-10525-0,Taiwo KolajoOlawande Daramola,2023,https://link.springer.com/article/10.1007/s10462-023-10525-0,Article
Automated requirement contradiction detection through formal logic and LLMs,Automated Software Engineering,,,,10.1007/s10515-024-00452-x,Alexander Elenga GärtnerDietmar Göhlich,2024,https://link.springer.com/article/10.1007/s10515-024-00452-x,Article
Optimal monitoring and attack detection of networks modeled by Bayesian attack graphs,Cybersecurity,,,,10.1186/s42400-023-00155-y,Armita KazeminajafabadiMahdi Imani,2023,https://link.springer.com/article/10.1186/s42400-023-00155-y,Article
Exploring facial cues: automated deception detection using artificial intelligence,Neural Computing and Applications,,,,10.1007/s00521-024-09811-x,Laslo DingesMarc-André FiedlerAyoub Al-HamadiThorsten HempelAhmed AbdelrahmanJoachim WeimannDmitri BershadskyyJohann Steiner,2024,https://link.springer.com/article/10.1007/s00521-024-09811-x,Article
VoteDroid: a new ensemble voting classifier for malware detection based on fine-tuned deep learning models,Multimedia Tools and Applications,,,,10.1007/s11042-024-19390-7,Halit Bakır,2024,https://link.springer.com/article/10.1007/s11042-024-19390-7,Article
Fairness as a Service (FaaS): verifiable and privacy-preserving fairness auditing of machine learning systems,International Journal of Information Security,,,,10.1007/s10207-023-00774-z,Ehsan ToreiniMaryam MehrnezhadAad van Moorsel,2023,https://link.springer.com/article/10.1007/s10207-023-00774-z,Article
A review on visual privacy preservation techniques for active and assisted living,Multimedia Tools and Applications,,,,10.1007/s11042-023-15775-2,Siddharth RaviPau Climent-PérezFrancisco Florez-Revuelta,2023,https://link.springer.com/article/10.1007/s11042-023-15775-2,Article
Towards privacy-aware exploration of archived personal emails,International Journal on Digital Libraries,,,,10.1007/s00799-024-00394-5,Zoe BartliffYunhyong KimFrank Hopfgartner,2024,https://link.springer.com/article/10.1007/s00799-024-00394-5,Article
Enhancement of an IoT hybrid intrusion detection system based on fog-to-cloud computing,Journal of Cloud Computing,,,,10.1186/s13677-023-00420-y,Doaa MohamedOsama Ismael,2023,https://link.springer.com/article/10.1186/s13677-023-00420-y,Article
On the privacy of mental health apps,Empirical Software Engineering,,,,10.1007/s10664-022-10236-0,Leonardo Horn IwayaM. Ali BabarAwais RashidChamila Wijayarathna,2022,https://link.springer.com/article/10.1007/s10664-022-10236-0,Article
Solving imbalanced learning with outlier detection and features reduction,Machine Learning,,,,10.1007/s10994-023-06448-0,Salvatore LusitoAndrea PugnanaRiccardo Guidotti,2023,https://link.springer.com/article/10.1007/s10994-023-06448-0,Article
Evolutionary computation-based self-supervised learning for image processing: a big data-driven approach to feature extraction and fusion for multispectral object detection,Journal of Big Data,,,,10.1186/s40537-024-00988-5,Xiaoyang ShenHaibin LiAchyut ShankarWattana ViriyasitavatVinay Chamola,2024,https://link.springer.com/article/10.1186/s40537-024-00988-5,Article
Investigating the effectiveness of one-class and binary classification for fraud detection,Journal of Big Data,,,,10.1186/s40537-023-00825-1,Joffrey L. LeevyJohn HancockTaghi M. KhoshgoftaarAzadeh Abdollah Zadeh,2023,https://link.springer.com/article/10.1186/s40537-023-00825-1,Article
Evolution of automated weakness detection in Ethereum bytecode: a comprehensive study,Empirical Software Engineering,,,,10.1007/s10664-023-10414-8,Monika di AngeloThomas DurieuxJoão F. FerreiraGernot Salzer,2024,https://link.springer.com/article/10.1007/s10664-023-10414-8,Article
Unsafe-Net: YOLO v4 and ConvLSTM based computer vision system for real-time detection of unsafe behaviours in workplace,Multimedia Tools and Applications,,,,10.1007/s11042-024-19276-8,Oğuzhan ÖnalEmre Dandıl,2024,https://link.springer.com/article/10.1007/s11042-024-19276-8,Article
Securing internet of things using machine and deep learning methods: a survey,Cluster Computing,,,,10.1007/s10586-024-04509-0,Ali GhaffariNasim JelodariSamira pouralishNahide derakhshanfardBahman Arasteh,2024,https://link.springer.com/article/10.1007/s10586-024-04509-0,Article
